branch,hospital-types,number-of-patients,number-of-hospitalizations,ratio-of-rehospitalizations,percentage,percentage-of-sections,duration-of-hospitalization-mediana,duration-of-hospitalization-mode,average-value-of-hospitalization,average-value-of-hospitalization-points,average-value-of-drg,average-value-of-drg-points,name,catalog,year,period
,,639,672,1.05,0.01,0.1,1,1,1430.96,27.89,1403.4,27.02,F44 DIAGNOSTYCZNE  I LECZNICZE ZABIEGI JAMY BRZUSZNEJ *,1a,2014,2014
,,97931,102852,1.05,1.43,15.03,3,2,1606.98,31.64,1471.84,28.41,F46 CHOROBY JAMY BRZUSZNEJ,1a,2014,2014
,,8850,8988,1.02,0.12,1.31,4,2,1676.57,34.03,1621.6,31.41,F47 CHOROBY INFEKCYJNE JELIT,1a,2014,2014
,,358,368,1.03,0.01,0.05,11,8,12646.51,243.83,7938.45,153.0,F51 KOMPLEKSOWE ZABIEGI W CHOROBACH ZAPALNYCH JELIT *,1a,2014,2014
,,1242,1293,1.04,0.02,0.19,6,2,8852.5,187.26,6474.99,124.99,F52 DUŻE I ENDOSKOPOWE ZABIEGI W CHOROBACH ZAPALNYCH JELIT *,1a,2014,2014
,,24461,30510,1.25,0.42,4.46,6,2,4198.62,121.07,3936.92,75.99,F58 CHOROBY ZAPALNE JELIT,1a,2014,2014
,,254,254,1.0,0.0,0.04,16,9,19041.04,366.48,6505.69,125.24,F61 KOMPLEKSOWE ZABIEGI W KRWAWIENIACH Z PRZEWODU POKARMOWEGO *,1a,2014,2014
,,10400,10855,1.04,0.15,1.59,5,4,4556.13,88.26,3415.02,65.87,F62 DUŻE I ENDOSKOPOWE LECZNICZE ZABIEGI W KRWAWIENIACH Z PRZEWODU POKARMOWEGO *,1a,2014,2014
,,13597,14226,1.05,0.2,2.08,5,4,2084.48,40.59,1324.65,25.55,F66 KRWAWIENIA Z PRZEWODU POKARMOWEGO - LECZENIE ZACHOWAWCZE,1a,2014,2014
,,65320,66602,1.02,0.92,9.73,3,2,2610.88,50.61,2591.08,50.22,F72 OPERACJE PRZEPUKLIN JAMY BRZUSZNEJ Z WSZCZEPEM *,1a,2014,2014
,,26906,27148,1.01,0.38,3.97,2,2,1906.87,36.93,1865.01,36.12,F73 OPERACJE PRZEPUKLIN BRZUSZNYCH *,1a,2014,2014
,,9880,9884,1.0,0.14,1.44,5,4,3779.19,73.21,3650.02,70.36,F82 WYCIĘCIE WYROSTKA ROBACZKOWEGO Z POWIKŁANIAMI *,1a,2014,2014
,,19542,19550,1.0,0.27,2.86,4,3,2451.78,47.28,2433.19,46.92,F83 WYCIĘCIE WYROSTKA ROBACZKOWEGO *,1a,2014,2014
,,1679,1713,1.02,0.02,0.25,3,2,1599.78,30.85,1558.17,30.05,F86 CHOROBY WYROSTKA ROBACZKOWEGO,1a,2014,2014
,,19167,20389,1.06,0.28,2.98,3,3,1272.16,24.77,1255.96,24.44,F93 ŚREDNIE ZABIEGI ODBYTU *,1a,2014,2014
,,3719,3992,1.07,0.06,0.58,1,2,439.44,8.51,432.4,8.38,F94 MAŁE ZABIEGI ODBYTU I ODBYTNICY *,1a,2014,2014
,,2600,2709,1.04,0.04,0.4,5,2,2094.88,47.54,2022.28,39.0,F96 CHOROBY ODBYTU,1a,2014,2014
,,790,796,1.01,0.01,0.3,10,7,17075.66,329.38,14677.28,283.14,G01 ROZLEGŁE ZABIEGI WĄTROBY *,1a,2014,2014
,,1321,1760,1.33,0.02,0.65,4,3,8569.05,165.47,8306.06,160.29,G11 KOMPLEKSOWE ZABIEGI WĄTROBY *,1a,2014,2014
,,369,389,1.05,0.01,0.14,6,2,5332.54,102.94,2936.8,56.86,G12 DUŻE ZABIEGI WĄTROBY *,1a,2014,2014
,,360,366,1.02,0.01,0.14,4,1,2424.78,46.73,1141.9,22.0,G13 ŚREDNIE ZABIEGI WĄTROBY *,1a,2014,2014
,,777,807,1.04,0.01,0.3,1,1,469.69,9.06,466.83,9.0,G14 MAŁE ZABIEGI WĄTROBY *,1a,2014,2014
,,6718,7256,1.08,0.1,2.7,6,2,3203.62,63.19,2944.35,56.78,G16 OSTRE CHOROBY WĄTROBY,1a,2014,2014
,,21795,25639,1.18,0.36,9.53,9,6,5484.6,124.21,5165.39,99.8,G17 PRZEWLEKŁE CHOROBY WĄTROBY Z PW >5 DNI,1a,2014,2014
,,38585,44986,1.17,0.62,16.72,3,2,2307.7,117.54,2104.19,40.63,G18A PRZEWLEKŁE CHOROBY WĄTROBY BEZ PW  > 17 R. Ż.,1a,2014,2014
,,2526,2950,1.17,0.04,1.1,2,2,2129.05,42.57,1978.87,38.19,G18B PRZEWLEKŁE CHOROBY WĄTROBY BEZ PW < 18 R. Ż.,1a,2014,2014
,,1118,1122,1.0,0.02,0.42,15,10,16974.22,327.38,14275.55,275.26,G21 KOMPLEKSOWE ZABIEGI PRZEWODÓW ŻÓŁCIOWYCH *,1a,2014,2014
,,812,818,1.01,0.01,0.3,12,13,6265.12,120.95,4872.74,94.24,G22 DUŻE ZABIEGI PRZEWODÓW ŻÓŁCIOWYCH *,1a,2014,2014
,,12680,12684,1.0,0.18,4.71,4,3,4218.17,82.23,3670.17,70.82,G24 WYCIĘCIE PĘCHERZYKA ŻÓŁCIOWEGO Z PW *,1a,2014,2014
,,74269,74320,1.0,1.03,27.62,3,3,3335.24,64.88,3234.78,62.54,G25 WYCIĘCIE PĘCHERZYKA ŻÓŁCIOWEGO *,1a,2014,2014
,,16305,17406,1.07,0.24,6.47,4,2,1544.19,29.91,1416.04,27.34,G26 CHOROBY DRÓG ŻÓŁCIOWYCH,1a,2014,2014
,,3999,4644,1.16,0.06,1.73,5,2,3547.46,70.22,3365.61,64.94,G28 NOWOTWORY DRÓG ŻÓŁCIOWYCH,1a,2014,2014
,,12,12,1.0,0.0,0.0,17,11,83272.02,1601.39,82108.0,1579.0,G30 PRZESZCZEPIENIE TRZUSTKI *,1a,2014,2014
,,1365,1371,1.0,0.02,0.51,14,8,24755.36,488.67,15925.54,306.56,G31 KOMPLEKSOWE ZABIEGI TRZUSTKI,1a,2014,2014
,,654,666,1.02,0.01,0.25,10,7,9739.15,187.33,5998.61,115.4,G32 DUŻE ZABIEGI TRZUSTKI *,1a,2014,2014
,,1910,2014,1.05,0.03,0.75,3,2,8536.88,166.28,8209.57,158.25,G33 ZABIEGI ENDOSKOPOWE I PRZEZSKÓRNE DRÓG ŻÓŁCIOWYCH I TRZUSTKI Z WPROWADZENIEM PROTEZY SAMOROZPRĘŻALNEJ *,1a,2014,2014
,,19453,24359,1.25,0.34,9.05,4,2,4428.36,85.75,4221.35,81.5,G34 ZABIEGI ENDOSKOPOWE I PRZEZSKÓRNE DRÓG ŻÓŁCIOWYCH I TRZUSTKI *,1a,2014,2014
,,4883,5252,1.08,0.07,1.95,1,0,2395.48,46.27,2393.29,46.23,G35 INNE ZABIEGI DRÓG ŻÓŁCIOWYCH I TRZUSTKI *,1a,2014,2014
,,4301,4467,1.04,0.06,1.66,13,10,20575.55,398.27,15259.46,294.7,G36 OSTRE ZAPALENIE TRZUSTKI O CIĘŻKIM PRZEBIEGU,1a,2014,2014
,,18976,21000,1.11,0.29,7.8,6,6,3843.03,74.51,2966.26,57.22,G37 OSTRE ZAPALENIE TRZUSTKI,1a,2014,2014
,,10412,12508,1.2,0.17,4.65,5,2,2936.43,61.2,2746.25,53.03,G38 PRZEWLEKŁE CHOROBY TRZUSTKI,1a,2014,2014
,,1529,1533,1.0,0.02,0.57,8,7,10510.76,221.82,5756.17,110.87,G42 ZABIEGI ŚLEDZIONY *,1a,2014,2014
,,1280,1295,1.01,0.02,0.21,7,7,9751.37,191.46,4754.87,92.03,"H01 ENDOPROTEZOPLASTYKA ŁOKCIA, BARKU, NADGARSTKA, STAWU SKOKOWO-GOLENIOWEGO, PIERWOTNA CZĘŚCIOWA KOLANA *",1a,2014,2014
,,1519,1534,1.01,0.02,0.25,12,10,5894.55,154.1,5315.5,102.82,H02 ENDOPROTEZOPLASTYKA PIERWOTNA CZĘŚCIOWA STAWU BIODROWEGO *,1a,2014,2014
,,6629,6676,1.01,0.09,1.08,11,9,9155.15,189.58,8635.64,167.09,"H04 ENDOPROTEZOPLASTYKA PIERWOTNA CAŁKOWITA CEMENTOWA, BIPOLARNA BIODRA *",1a,2014,2014
,,22915,23179,1.01,0.32,3.74,9,8,12345.99,251.83,12102.22,234.27,"H05 ENDOPROTEZOPLASTYKA PIERWOTNA CAŁKOWITA KOLANA, BEZCEMENTOWA BIODRA *",1a,2014,2014
,,20385,20730,1.02,0.29,3.34,8,8,19950.49,405.82,19709.83,381.43,"H06 ENDOPROTEZOPLASTYKA PIERWOTNA CAŁKOWITA BIODRA LUB KOLANA Z REKONSTRUKCJĄ KOSTNĄ, ENDOPROTEZOPLASTYKA STAWU BIODROWEGO Z ZASTOSOWANIEM TRZPIENIA PRZYNASADOWEGO, KAPOPLASTYKA STAWU BIODROWEGO *",1a,2014,2014
,,1626,1659,1.02,0.02,0.27,11,8,13981.3,278.57,13450.19,259.7,H07 ENDOPROTEZOPLASTYKA REWIZYJNA CZĘŚCIOWA *,1a,2014,2014
,,2185,2229,1.02,0.03,0.36,12,8,26426.49,544.31,25535.82,492.85,H08 ENDOPROTEZOPLASTYKA REWIZYJNA CAŁKOWITA *,1a,2014,2014
,,223,228,1.02,0.0,0.04,14,15,9706.18,191.93,9141.93,176.39,"H09 ZABIEGI OPERACYJNE - REWIZYJNE Z POWODU ASEPTYCZNEGO OBLUZOWANIA LUB Z TOWARZYSZĄCYM ZŁAMANIEM ""OKOŁOPROTEZOWYM"" *",1a,2014,2014
,,695,759,1.09,0.01,0.12,19,18,17711.25,360.76,16438.33,317.68,H10 ZABIEGI OPERACYJNE - REWIZYJNE W PRZYPADKACH INFEKCJI WOKÓŁ PROTEZY *,1a,2014,2014
,,325,331,1.02,0.0,0.05,12,9,32956.99,666.88,12832.73,246.8,H11 ZABIEGI RESEKCYJNE ZMIAN NOWOTWOROWYCH LUB GUZOWATYCH Z ENDOPROTEZOPLASTYKĄ LUB ZABIEG REWIZYJNY Z UŻYCIEM PROTEZ PORESEKCYJNYCH *,1a,2014,2014
,,151,158,1.05,0.0,0.03,21,21,15568.96,299.42,12857.78,247.34,H12 CZASOWE IMPLANTY UWALNIAJĄCE ANTYBIOTYKI W LECZENIU INFEKCJI OKOŁOPROTEZOWYCH *,1a,2014,2014
,,15784,16054,1.02,0.22,2.59,2,2,4318.38,83.86,4318.01,83.85,H21 ARTROSKOPOWA REKONSTRUKCJA Z UŻYCIEM IMPLANTÓW MOCUJĄCYCH *,1a,2014,2014
,,56313,57368,1.02,0.8,9.25,2,2,2746.12,53.51,2745.24,53.41,H22 ARTROSKOPIA LECZNICZA *,1a,2014,2014
,,2020,2029,1.0,0.03,0.33,2,2,1490.7,29.88,1481.36,28.58,H23 ARTROSKOPIA DIAGNOSTYCZNO - LECZNICZA *,1a,2014,2014
,,10471,10791,1.03,0.15,1.74,4,3,13068.67,253.92,12944.0,249.32,H31 KOMPLEKSOWE ZABIEGI W ZAKRESIE KOŃCZYNY DOLNEJ I MIEDNICY *,1a,2014,2014
,,20452,21308,1.04,0.3,3.44,3,2,4744.53,93.47,4675.73,90.67,H32 DUŻE ZABIEGI W ZAKRESIE KOŃCZYNY DOLNEJ I MIEDNICY *,1a,2014,2014
,,25036,26760,1.07,0.37,4.31,2,2,1256.98,24.6,1252.83,24.23,H33 ŚREDNIE ZABIEGI NA KOŃCZYNIE DOLNEJ *,1a,2014,2014
,,1396,1457,1.04,0.02,0.23,3,2,10951.74,211.48,10820.75,208.67,"H41 REKONSTRUKCJA FUNKCJI RĘKI, W TYM MIKROCHIRURGICZNA *",1a,2014,2014
,,14905,15555,1.04,0.22,2.51,2,2,4222.81,82.9,4153.75,80.41,H42 DUŻE ZABIEGI NA KOŃCZYNIE GÓRNEJ *,1a,2014,2014
,,25218,26155,1.04,0.36,4.22,1,2,1236.83,24.29,1235.58,23.92,H43 ŚREDNIE ZABIEGI NA KOŃCZYNIE GÓRNEJ *,1a,2014,2014
,,4426,4574,1.03,0.06,0.74,9,8,29188.14,637.41,26761.96,516.84,H51 KOMPLEKSOWE ZABIEGI KOREKCYJNE KRĘGOSŁUPA *,1a,2014,2014
,,13991,14249,1.02,0.2,2.3,6,3,14417.29,304.69,13947.15,271.31,H52 ZABIEGI NA KRĘGOSŁUPIE Z ZASTOSOWANIEM IMPLANTÓW *,1a,2014,2014
,,2861,3027,1.06,0.04,0.49,3,2,9624.12,209.54,9373.27,181.66,H53 ZABIEGI NA KRĘGOSŁUPIE BEZ STOSOWANIA IMPLANTÓW *,1a,2014,2014
,,2787,3114,1.12,0.04,0.5,0,0,3223.37,66.61,3217.42,62.44,H55 ZABIEGI ARTROSKOPOWE I PRZEZSKÓRNE W ZAKRESIE KRĘGOSŁUPA *,1a,2014,2014
,,3277,3291,1.0,0.05,0.53,6,4,1570.25,34.79,1554.25,30.01,H56 ZESPOŁY BÓLOWE KRĘGOSŁUPA > 3 DNI,1a,2014,2014-01-01T00:00:00-2014-04-30T00:00:00
,,1850,1910,1.03,0.03,0.31,2,3,631.49,16.77,617.89,11.96,H56C ZESPOŁY BÓLOWE KRĘGOSLUPA < 4 DNI,1a,2014,2014-05-01T00:00:00-2014-12-31T00:00:00
,,4808,4843,1.01,0.07,0.78,7,4,1573.0,38.15,1543.5,29.99,H56D ZESPOŁY BÓLOWE KRĘGOSŁUPA >3 DNI,1a,2014,2014
,,111,111,1.0,0.0,0.02,23,18,34077.11,659.37,23107.14,448.4,H60 REKONSTRUKCJA ZŁAMAŃ W OBRĘBIE MIEDNICY Z PW *,1a,2014,2014
,,383,384,1.0,0.01,0.06,18,15,18918.18,371.18,16133.68,315.54,H61 REKONSTRUKCJA ZŁAMAŃ W OBRĘBIE MIEDNICY BEZ PW *,1a,2014,2014
,,46515,47054,1.01,0.65,7.59,8,4,5033.27,100.86,4660.6,89.95,H62 ZŁAMANIA LUB ZWICHNIĘCIA W OBRĘBIE MIEDNICY LUB KOŃCZYNY DOLNEJ *,1a,2014,2014
,,41587,42031,1.01,0.58,6.78,3,2,3695.05,72.15,3612.89,69.76,H63 ZŁAMANIA LUB ZWICHNIĘCIA W OBRĘBIE KOŃCZYNY GÓRNEJ *,1a,2014,2014
,,25372,26222,1.03,0.36,4.23,1,1,784.73,15.3,768.08,14.79,H64 MNIEJSZE ZŁAMANIA LUB ZWICHNIĘCIA *,1a,2014,2014
,,1989,1999,1.0,0.03,0.32,18,11,5673.09,116.6,5014.49,96.71,"H66 CZYNNOŚCIOWE LECZENIE ZŁAMAŃ KOŚCI DŁUGICH, STAWOWYCH, MIEDNICY, KRĘGOSŁUPA > 10 DNI",1a,2014,2014
,,1684,1693,1.01,0.02,0.27,5,4,2758.82,53.21,2328.92,44.93,"H67 CZYNNOŚCIOWE LECZENIE ZŁAMAŃ KOŚCI DŁUGICH, STAWOWYCH, MIEDNICY, KRĘGOSŁUPA",1a,2014,2014
,,8815,9409,1.07,0.13,1.52,11,7,7414.35,147.02,6246.92,120.61,H72 AMPUTACJE ROZLEGŁE I DUŻE *,1a,2014,2014
,,3045,3147,1.03,0.04,0.51,2,1,1412.07,27.14,1260.92,24.37,H74 MNIEJSZE AMPUTACJE *,1a,2014,2014
,,2503,2634,1.05,0.04,0.42,16,11,11231.04,220.92,10461.67,202.12,"H81 KOMPLEKSOWE ZABIEGI W CHOROBACH INFEKCYJNYCH, NOWOTWOROWYCH KOŚCI, STAWÓW, TKANKI ŁĄCZNEJ > 10 DNI *",1a,2014,2014
,,3386,3498,1.03,0.05,0.56,3,2,3771.49,73.23,3575.41,69.12,"H82 DUŻE ZABIEGI W CHOROBACH INFEKCYJNYCH, NOWOTWOROWYCH  KOŚCI, STAWÓW, TKANKI ŁĄCZNEJ *",1a,2014,2014
,,68291,72044,1.06,1.0,11.62,1,0,1874.65,36.84,1847.35,35.98,H83 ŚREDNIE ZABIEGI NA TKANKACH MIĘKKICH *,1a,2014,2014
,,9942,10160,1.02,0.14,1.64,0,0,532.35,10.38,513.03,10.0,H84 MNIEJSZE ZABIEGI W OBRĘBIE UKŁADU MIĘŚNIOWO-SZKIELETOWEGO LUB TKANEK MIĘKKICH *,1a,2014,2014
,,1838,1843,1.0,0.03,0.3,3,2,809.59,15.59,638.19,12.3,H85 POURAZOWE USZKODZENIA POZA USZKODZENIEM MÓZGU > 17 R.Ż.,1a,2014,2014
,,7869,8240,1.05,0.11,1.33,2,2,1188.24,26.22,1162.7,22.44,H86 CHOROBY TKANEK MIĘKKICH,1a,2014,2014
,,15178,15634,1.03,0.22,2.52,9,5,3595.69,82.67,3545.89,68.28,H87 CHOROBY ZAPALNE STAWÓW I TKANKI ŁĄCZNEJ,1a,2014,2014-01-01T00:00:00-2014-04-30T00:00:00
,,3345,3777,1.13,0.05,0.61,1,0,1273.15,32.19,1244.9,23.99,H87C CHOROBY ZAPALNE STAWÓW  I TKANKI ŁĄCZNEJ < 4 DNI,1a,2014,2014-05-01T00:00:00-2014-12-31T00:00:00
,,30416,32482,1.07,0.45,5.24,9,4,3578.83,84.94,3533.61,68.27,H87D CHOROBY ZAPALNE STAWÓW I TKANKI ŁĄCZNEJ > 3 DNI,1a,2014,2014
,,3097,3360,1.08,0.05,0.54,9,7,3604.2,74.52,3445.59,66.52,H88 CHOROBY INFEKCYJNE KOŚCI I STAWÓW,1a,2014,2014
,,13015,16549,1.27,0.23,2.67,1,0,638.75,15.32,622.71,12.0,H89C CHOROBY NIEZAPALNE KOŚCI I STAWÓW < 4 DNI,1a,2014,2014
,,23105,24925,1.08,0.35,4.02,7,4,2219.68,48.81,2183.95,42.13,H89D CHOROBY NIEZAPALNE KOŚCI I STAWÓW > 3 DNI,1a,2014,2014
,,68,75,1.1,0.0,0.01,15,12,11140.84,214.25,6576.96,126.48,H90 ZAPALENIA STAWÓW I UKŁADOWE CHOROBY TKANKI ŁĄCZNEJ WYMAGAJĄCE INTENSYWNEGO LECZENIA > 10 DNI,1a,2014,2014
,,1548,1674,1.08,0.02,0.27,4,2,8972.88,173.17,8958.23,172.89,H92 ZABIEGI REKONSTRUKCYJNE DEFORMACJI UKŁADU KOSTNO-STAWOWEGO < 18 R.Ż.,1a,2014,2014
,,7851,11549,1.47,0.16,1.86,3,0,1724.35,33.33,1551.27,30.0,H96C UKŁADOWE CHOROBY TKANKI ŁĄCZNEJ,1a,2014,2014
,,6328,6997,1.11,0.1,1.13,8,4,4711.82,94.31,4450.75,85.79,H96D UKŁADOWE CHOROBY TKANKI ŁĄCZNEJ > 3 DNI,1a,2014,2014
,,1087,1139,1.05,0.02,0.18,7,4,1905.53,36.87,1882.59,36.43,H98 KRYSTALOPATIE,1a,2014,2014
,,345,354,1.03,0.0,0.16,6,4,8757.25,169.95,8730.05,169.42,J01 RADYKALNE ODJĘCIE PIERSI Z REKONSTRUKCJĄ *,1a,2014,2014
,,13830,14105,1.02,0.2,6.44,5,4,5322.13,103.47,5254.83,102.06,J02 KOMPLEKSOWE ZABIEGI W OBRĘBIE PIERSI *,1a,2014,2014
,,7235,7408,1.02,0.1,3.38,2,2,2665.7,51.99,2659.77,51.83,J03 DUŻE ZABIEGI W OBRĘBIE PIERSI *,1a,2014,2014
,,1356,1631,1.2,0.02,0.75,4,3,4818.21,93.84,4811.4,93.7,J04 ZABIEGI REKONSTRUKCYJNE PIERSI *,1a,2014,2014
,,6075,6211,1.02,0.09,2.84,1,0,1161.66,22.78,1161.42,22.78,J05 ŚREDNIA CHIRURGIA PIERSI *,1a,2014,2014
,,3804,3846,1.01,0.05,1.76,1,0,543.72,10.54,540.8,10.49,J06 MAŁA CHIRURGIA PIERSI *,1a,2014,2014
,,1113,1137,1.02,0.02,0.52,1,0,596.22,11.49,592.24,11.42,J07 CHOROBY PIERSI ŁAGODNE *,1a,2014,2014
,,5542,6683,1.21,0.09,3.05,2,2,1757.09,73.76,1578.8,30.56,J08 CHOROBY PIERSI ZŁOŚLIWE *,1a,2014,2014
,,6079,6497,1.07,0.09,2.97,4,2,3923.21,77.94,3871.25,75.05,J09 WYCIĘCIE WĘZŁÓW CHŁONNYCH,1a,2014,2014
,,7138,7562,1.06,0.1,3.45,0,0,2045.97,40.02,2045.9,40.0,J10 BIOPSJA MAMMOTOMICZNA *,1a,2014,2014
,,63,63,1.0,0.0,0.03,14,1,107790.61,2073.36,61053.73,1174.46,J22 EKSTREMALNE OPARZENIA Z ZABIEGIEM CHIRURGICZNYM > 15 DNI *,1a,2014,2014
,,815,820,1.01,0.01,0.37,22,13,58148.34,1278.54,45760.34,887.2,J23 CIĘŻKIE OPARZENIA Z ZABIEGIEM CHIRURGICZNYM > 10 DNI *,1a,2014,2014
,,1273,1290,1.01,0.02,0.59,12,6,34664.97,697.67,33729.51,651.51,J24 ŚREDNIE OPARZENIA/ODMROŻENIA Z ZABIEGIEM CHIRURGICZNYM > 5 DNI *,1a,2014,2014
,,244,245,1.0,0.0,0.11,14,11,22935.52,542.63,14447.62,280.8,J26 CIĘŻKIE OPARZENIA > 10 DNI,1a,2014,2014
,,1701,1716,1.01,0.02,0.78,9,6,4817.92,95.56,4618.99,89.04,J27 ŚREDNIE OPARZENIA/ODMROŻENIA > 5 DNI,1a,2014,2014
,,4421,4448,1.01,0.06,2.03,4,2,2405.17,47.18,2221.74,42.89,J28 LEKKIE OPARZENIA/ODMROŻENIA,1a,2014,2014
,,69,70,1.01,0.0,0.03,1,1,1494.75,28.75,1195.67,23.0,J29 OPARZENIA/ODMROŻENIA PRZED PRZENIESIENIEM DO ODDZIAŁU SPECJALISTYCZNEGO,1a,2014,2014
,,12568,13404,1.07,0.19,6.12,2,0,3299.44,65.68,3201.28,62.17,J32 DUŻE ZABIEGI SKÓRNE *,1a,2014,2014
,,39172,41224,1.05,0.57,18.83,0,0,957.83,18.6,954.35,18.53,J33 ŚREDNIE ZABIEGI SKÓRNE *,1a,2014,2014
,,7671,8471,1.1,0.12,3.87,10,7,7062.59,138.34,6612.57,127.79,J34 LECZENIE CHIRURGICZNE ZMIAN TROFICZNYCH STOPY *,1a,2014,2014
,,758,1330,1.75,0.02,0.61,0,0,1324.89,25.62,1235.35,23.9,J35 LECZENIE ANOMALII NACZYNIOWYCH LASEREM PULSACYJNO-BARWNIKOWYM<18 R.Ż.,1a,2014,2014
,,13615,16067,1.18,0.22,7.34,9,7,3775.53,73.13,3419.34,65.98,J37 OWRZODZENIA SKÓRY,1a,2014,2014
,,6231,7186,1.15,0.1,3.28,5,3,4285.18,82.62,4167.46,80.35,J38 CIĘŻKIE CHOROBY DERMATOLOGICZNE,1a,2014,2014
,,26626,30198,1.13,0.42,13.8,6,3,1721.2,33.72,1685.23,32.48,J39 DUŻE CHOROBY DERMATOLOGICZNE,1a,2014,2014
,,11562,11854,1.03,0.16,5.42,6,5,2249.93,43.9,2052.66,39.65,J46 DUŻE CHOROBY INFEKCYJNE SKÓRY,1a,2014,2014
,,1638,1778,1.09,0.02,0.81,2,0,2273.02,90.01,2184.03,42.14,J47 DUŻE GUZY SKÓRY,1a,2014,2014
,,21945,23286,1.06,0.32,10.64,2,2,1067.81,20.6,1047.94,20.22,J49 ŁAGODNE CHOROBY DERMATOLOGICZNE,1a,2014,2014
,,2033,2049,1.01,0.03,0.99,4,3,14832.53,287.44,14754.53,285.83,K01 ZABIEGI RADYKALNE W RAKACH GRUCZOŁÓW DOKREWNYCH *,1a,2014,2014
,,1614,1614,1.0,0.02,0.78,3,3,6654.3,130.04,6625.72,129.49,K02 OPERACJA WOLA GUZOWATEGO POWIKŁANEGO *,1a,2014,2014
,,19935,20032,1.0,0.28,9.71,4,3,3923.22,76.07,3840.07,74.33,K03 ZABIEGI DOTYCZĄCE TARCZYCY I PRZYTARCZYC *,1a,2014,2014
,,1036,1041,1.0,0.01,0.5,7,7,11869.78,230.94,10723.74,207.38,K04 ZABIEGI DOTYCZĄCE NADNERCZY *,1a,2014,2014
,,419,434,1.04,0.01,0.21,0,0,634.78,12.21,629.99,12.12,"K05 ZABIEGI DIAGNOSTYCZNE TARCZYCY, PRZYTARCZYC, NADNERCZY *",1a,2014,2014
,,89,89,1.0,0.0,0.04,7,4,4522.51,87.52,4400.03,85.17,K06 STANY NAGLĄCE W ENDOKRYNOLOGII,1a,2014,2014
,,7326,7919,1.08,0.11,3.84,2,2,2022.87,39.0,2015.48,38.87,K16 CHOROBY  PRZYSADKI,1a,2014,2014
,,13293,13967,1.05,0.19,6.77,5,4,1567.64,31.28,1460.93,28.23,K26 ZABURZENIA WODNO-ELEKTROLITOWE,1a,2014,2014
,,25290,26488,1.05,0.37,12.84,5,2,2821.97,55.04,2561.08,49.67,K27A ZABURZENIA ODŻYWIENIA > 17 R.Ż.,1a,2014,2014
,,7139,7712,1.08,0.11,3.74,2,2,2467.88,47.56,2370.72,45.69,K27B ZABURZENIA ODŻYWIENIA < 18 R. Ż.,1a,2014,2014
,,17925,20742,1.16,0.29,10.05,3,2,3720.39,73.87,3671.28,71.39,K28 WRODZONE WADY METABOLICZNE,1a,2014,2014
,,23061,24060,1.04,0.33,11.66,6,6,2347.61,45.61,2267.8,43.86,K35 CUKRZYCA Z POWIKŁANIAMI I INNE STANY HIPOGLIKEMICZNE,1a,2014,2014
,,5306,5756,1.08,0.08,2.79,7,7,2752.82,53.64,2516.25,48.52,K37 CUKRZYCA ZE STANAMI HIPERGLIKEMICZNYMI,1a,2014,2014
,,3572,4032,1.13,0.06,1.95,9,7,4612.18,89.0,4414.12,85.19,K39 STOPA CUKRZYCOWA,1a,2014,2014
,,181,186,1.03,0.0,0.09,7,7,2958.23,57.07,2944.71,56.81,K46 CIĘŻKIE CHOROBY TARCZYCY,1a,2014,2014
,,12199,13226,1.08,0.18,6.41,3,0,1475.39,28.83,1443.05,27.88,K47 CHOROBY TARCZYCY,1a,2014,2014
,,563,1554,2.76,0.02,0.75,2,2,3056.32,59.22,3054.64,59.19,K48 ORBITOPATIA TARCZYCOWA - TERAPIA PRZECIWZAPALNA I PRZYGOTOWANIE DO RADIOTERAPII I LECZENIA DEKOMPRESYJNEGO,1a,2014,2014
,,14770,16918,1.15,0.23,8.2,3,2,3561.57,68.9,3560.04,68.76,"K53 NADCZYNNOŚĆ GRUCZOŁÓW DOKREWNYCH POZA HIPERPROLAKTYNEMIĄ, NADCZYNNOŚCIĄ TARCZYCY I GUZAMI NEUROENDOKRYNNYMI PRZEWODU POKARMOWEGO I UKŁADU ODDECHOWEGO",1a,2014,2014
,,247,258,1.04,0.0,0.13,5,4,2257.55,43.74,2256.15,43.71,K54 AUTOIMMUNOLOGICZNE ZESPOŁY WIELOGRUCZOŁOWE,1a,2014,2014
,,1320,1394,1.06,0.02,0.68,2,2,5037.67,96.89,5037.37,96.88,"K55 RAKI GRUCZOŁÓW DOKREWNYCH Z ZABURZENIAMI CZYNNOŚCI HORMONALNEJ, NOWOTWOROWE ZESPOŁY WIELOGRUCZOŁOWE ORAZ EKTOPOWE WYDZIELANIE HORMONÓW Z WYŁACZENIEM GUZÓW NEUROENDOKRYNNYCH PRZEWODU POKARMOWEGO I UKŁADU ODDECHOWEGO",1a,2014,2014
,,362,452,1.25,0.01,0.22,3,2,4748.42,100.25,3269.99,63.69,K56 GUZY ZŁOŚLIWE GRUCZOŁÓW DOKREWNYCH BEZ ZABURZEŃ CZYNNOŚCI HORMONALNEJ,1a,2014,2014
,,295,342,1.16,0.0,0.17,4,3,4627.52,265.55,4440.53,85.39,K57 GUZY NEUROENDOKRYNNE,1a,2014,2014
,,5263,5883,1.12,0.08,2.85,3,2,2685.0,88.03,2538.82,49.04,K58 NOWOTWORY ENDOKRYNNE POZA PRZYSADKĄ,1a,2014,2014
,,27018,28297,1.05,0.39,13.72,5,3,1951.23,38.04,1893.28,36.61,K59 INNE CHOROBY UKŁADU WYDZIELANIA WEWNĘTRZNEGO,1a,2014,2014
,,1701,1868,1.1,0.03,0.91,4,4,10420.43,202.82,9961.67,194.0,K63 KWALIFIKACJA DO LECZENIA JODEM RADIOAKTYWNYM RAKA TARCZYCY LUB OCENA SKUTECZNOŚCI LECZENIA Z ZASTOSOWANIEM REKOMBINOWANEGO TSH [RHTSH],1a,2014,2014
,,5599,5649,1.01,0.08,1.24,8,8,8306.9,160.31,7839.26,151.2,L01 KOMPLEKSOWE OTWARTE ZABIEGI NEREK,1a,2014,2014
,,2997,3018,1.01,0.04,0.66,9,8,6946.44,134.03,6070.51,117.16,L02 DUŻE OTWARTE ZABIEGI NEREK,1a,2014,2014
,,768,781,1.02,0.01,0.17,9,8,3698.52,71.3,3372.11,65.01,L03 ŚREDNIE OTWARTE ZABIEGI NEREK *,1a,2014,2014
,,4247,4489,1.06,0.06,0.99,6,4,5285.87,105.17,5175.26,99.95,L05 DUŻE ENDOSKOPOWE ZABIEGI NEREK *,1a,2014,2014
,,2781,3101,1.12,0.04,0.68,3,2,2273.14,43.98,2081.21,40.21,L06 ŚREDNIE ENDOSKOPOWE ZABIEGI NEREK *,1a,2014,2014
,,19077,19947,1.05,0.28,4.38,6,5,1325.62,27.7,1247.3,24.09,L07 ZAKAŻENIA NEREK LUB DRÓG MOCZOWYCH,1a,2014,2014
,,9369,12348,1.32,0.17,2.71,2,2,2985.05,94.99,2815.42,54.3,L08 NOWOTWORY NEREK I DRÓG MOCZOWYCH,1a,2014,2014
,,1730,3181,1.84,0.04,0.7,0,0,1207.25,23.37,1202.08,23.29,L09 MAŁE ZABIEGI NEREK *,1a,2014,2014
,,20270,24885,1.23,0.35,5.46,0,0,330.4,7.4,317.85,6.13,L104 INNE PROCEDURY W ZAKRESIE UKŁADU MOCZOWO - PŁCIOWEGO *,1a,2014,2014
,,465,471,1.01,0.01,0.1,10,9,5746.16,111.06,5488.56,106.1,L12 DUŻE OTWARTE ZABIEGI MOCZOWODU *,1a,2014,2014
,,578,591,1.02,0.01,0.13,9,8,3689.21,71.23,3163.53,61.12,L13 ŚREDNIE OTWARTE ZABIEGI MOCZOWODU *,1a,2014,2014
,,14327,15949,1.11,0.22,3.5,3,2,4152.23,80.31,4110.7,79.51,L15 DUŻE ENDOSKOPOWE ZABIEGI MOCZOWODU *,1a,2014,2014
,,1482,1592,1.07,0.02,0.35,2,0,1966.88,38.77,1946.12,38.18,L16 ŚREDNIE ENDOSKOPOWE ZABIEGI MOCZOWODU *,1a,2014,2014
,,9299,11096,1.19,0.15,2.44,2,0,1330.19,25.73,1249.79,24.18,L17 MAŁE ENDOSKOPOWE ZABIEGI MOCZOWODU *,1a,2014,2014
,,908,908,1.0,0.01,0.2,15,14,20353.7,392.26,17585.23,338.95,L21 KOMPLEKSOWE ZABIEGI PĘCHERZA MOCZOWEGO Z WYTWORZENIEM PRZETOKI *,1a,2014,2014
,,850,850,1.0,0.01,0.19,14,11,18119.62,349.02,15909.46,306.45,"L22 DUŻE OTWARTE ZABIEGI NA PĘCHERZU MOCZOWYM, W TYM PLASTYKA *",1a,2014,2014
,,737,748,1.01,0.01,0.16,8,8,2543.82,48.98,1906.34,36.71,L23 ŚREDNIE OTWARTE ZABIEGI NA PĘCHERZU MOCZOWYM *,1a,2014,2014
,,206,217,1.05,0.0,0.05,9,8,6329.5,122.19,4573.18,88.33,L24 ZABIEGI W ZAKRESIE PRZETOK ODPROWADZAJĄCYCH MOCZ *,1a,2014,2014
,,127,141,1.11,0.0,0.03,3,2,4476.86,86.1,4444.87,85.49,L25 DUŻE ENDOSKOPOWE ZABIEGI NA PĘCHERZU MOCZOWYM *,1a,2014,2014
,,24427,31587,1.29,0.44,6.94,3,2,2700.42,53.18,2658.89,51.42,L26 ŚREDNIE ZABIEGI ENDOSKOPOWE NA PĘCHERZU MOCZOWYM *,1a,2014,2014
,,4415,4711,1.07,0.07,1.03,0,0,415.0,7.95,406.45,7.84,L27 ZABURZENIA ODPŁYWU MOCZU,1a,2014,2014
,,5408,6680,1.24,0.09,1.47,0,0,733.44,14.13,670.1,12.91,L29 CHOROBY PĘCHERZA MOCZOWEGO I MOCZOWODU,1a,2014,2014
,,7174,8060,1.12,0.11,1.77,0,0,962.8,18.69,955.23,18.54,L30 MAŁE ZABIEGI PĘCHERZA MOCZOWEGO *,1a,2014,2014
,,3855,3856,1.0,0.05,0.85,8,7,8480.68,163.97,8269.22,159.89,L31 RADYKALNA PROSTATEKTOMIA *,1a,2014,2014
,,1819,1819,1.0,0.03,0.4,10,9,5608.3,107.98,5312.75,102.29,L32 OTWARTE ZABIEGI GRUCZOŁU KROKOWEGO I SZYI PĘCHERZA MOCZOWEGO *,1a,2014,2014
,,15165,15747,1.04,0.22,3.46,4,3,3602.87,69.82,3576.66,69.08,L43 PRZEZCEWKOWA RESEKCJA GRUCZOŁU KROKOWEGO *,1a,2014,2014
,,366,383,1.05,0.01,0.08,2,2,1548.14,29.96,1502.23,29.01,L45 ENDOSKOPOWE ZABIEGI GRUCZOŁU KROKOWEGO LUB PĘCHERZA MOCZOWEGO *,1a,2014,2014
,,4827,5548,1.15,0.08,1.22,2,1,610.17,14.89,537.77,10.39,L46 CHOROBY GRUCZOŁU KROKOWEGO,1a,2014,2014
,,21064,21806,1.04,0.3,4.79,0,0,1099.0,21.22,1098.46,21.21,L47 MAŁE ZABIEGI GRUCZOŁU KROKOWEGO LUB PĘCHERZA MOCZOWEGO *,1a,2014,2014
,,1787,1846,1.03,0.03,0.41,4,2,4492.65,86.68,4423.34,85.35,L52 DUŻE OTWARTE ZABIEGI CEWKI MOCZOWEJ *,1a,2014,2014
,,5403,6136,1.14,0.09,1.35,2,2,1778.35,34.93,1761.86,34.19,L53 ŚREDNIE ZABIEGI CEWKI MOCZOWEJ *,1a,2014,2014
,,1443,1650,1.14,0.02,0.36,0,0,632.37,12.28,617.89,12.0,L54 MAŁE ZABIEGI CEWKI MOCZOWEJ *,1a,2014,2014
,,1040,1068,1.03,0.01,0.23,2,0,2712.38,52.77,2641.76,51.41,L62 DUŻE I ŚREDNIE ZABIEGI PRĄCIA *,1a,2014,2014
,,11075,11246,1.02,0.16,2.47,0,0,593.66,11.54,565.93,11.0,L64 MAŁE ZABIEGI  PRĄCIA *,1a,2014,2014
,,4339,4549,1.05,0.06,1.0,3,2,851.63,18.66,818.79,15.81,"L69 CHOROBY PRĄCIA, JĄDER, NASIENIOWODU, MOCZOWODU I CEWKI MOCZOWEJ",1a,2014,2014
,,13445,13971,1.04,0.19,3.07,3,2,1602.91,31.06,1564.29,30.33,"L72A ZABIEGI MOSZNY, JĄDRA, NAJĄDRZA I NASIENIOWODU > 17 R. Ż.",1a,2014,2014
,,12877,13327,1.03,0.19,2.93,2,2,2689.29,51.98,2682.3,51.85,"L72B ZABIEGI MOSZNY, JĄDRA, NAJĄDRZA I NASIENIOWODU < 18 R.Ż.",1a,2014,2014
,,4402,6546,1.49,0.09,1.44,6,2,4404.94,87.04,3403.31,66.25,L81 LECZENIE POWIKŁAŃ LECZENIA NERKOZASTĘPCZEGO > 17 R.Ż,1a,2014,2014
,,25161,26537,1.05,0.37,5.83,8,7,4847.78,94.5,4086.44,78.91,L82 OSTRA NIEWYDOLNOŚĆ NEREK,1a,2014,2014
,,17753,21485,1.21,0.3,4.72,5,2,2164.73,42.62,1784.31,34.48,L83 PRZEWLEKŁA NIEWYDOLNOŚĆ NEREK,1a,2014,2014
,,66707,82762,1.24,1.15,18.17,4,2,2876.61,56.75,2748.51,53.18,L84 INNE CHOROBY NEREK,1a,2014,2014
,,20192,21424,1.06,0.3,4.7,2,2,706.51,13.92,679.82,13.11,L85 KAMICA MOCZOWA,1a,2014,2014
,,4052,4226,1.04,0.06,0.93,2,2,640.78,13.4,459.32,8.86,L86 BADANIA W ZAKRESIE DRÓG MOCZOWYCH,1a,2014,2014
,,52,123,2.37,0.0,0.03,3,2,6477.4,124.77,3731.99,72.07,L87 LECZENIE POWIKŁAŃ LECZENIA NERKOZASTĘPCZEGO < 18 R.Ż,1a,2014,2014
,,80,81,1.01,0.0,0.02,7,2,29276.0,563.0,29276.0,563.0,L91 IMPLANTACJA LUB WYMIANA HYDRAULICZNEGO ZWIERACZA CEWKI MOCZOWEJ (AUS) *,1a,2014,2014
,,15696,27132,1.73,0.38,5.96,0,0,935.89,18.09,934.69,18.07,L92 ESWL *,1a,2014,2014
,,1090,1090,1.0,0.02,0.24,17,13,51370.55,988.05,45127.89,867.84,L94 PRZESZCZEPIENIE NERKI > 17 R. Ż. *,1a,2014,2014
,,26,26,1.0,0.0,0.01,20,16,52512.04,1009.85,49872.0,959.08,L96 PRZESZCZEPIENIE NERKI < 18 R.Ż.,1a,2014,2014
,,25,25,1.0,0.0,0.01,19,15,115445.51,2220.11,106912.0,2056.0,L97 PRZESZCZEPIENIE NERKI I TRZUSTKI *,1a,2014,2014
,,237,238,1.0,0.0,0.04,11,8,13721.21,265.31,13593.49,262.37,M01 KOMPLEKSOWE ZABIEGI DOLNEJ CZĘŚCI UKŁADU ROZRODCZEGO BEZ PW *,1a,2014,2014
,,25776,26169,1.02,0.36,4.94,5,4,4211.89,81.62,4193.27,81.27,M02 DUŻE ZABIEGI DOLNEJ CZĘŚCI UKŁADU ROZRODCZEGO *,1a,2014,2014
,,17053,17356,1.02,0.24,3.28,1,0,1246.02,24.14,1245.33,24.12,M03 ŚREDNIE ZABIEGI DOLNEJ CZĘŚCI UKŁADU ROZRODCZEGO *,1a,2014,2014
,,29067,30062,1.03,0.42,5.68,0,0,469.4,9.09,468.12,9.06,M04 MAŁE ZABIEGI DOLNEJ CZĘŚCI UKŁADU ROZRODCZEGO *,1a,2014,2014
,,8334,8456,1.01,0.12,1.6,3,2,3799.91,73.92,3799.16,73.91,M05 ZABIEGI W NIETRZYMANIU MOCZU *,1a,2014,2014
,,47,47,1.0,0.0,0.01,9,7,15341.44,295.03,15067.83,289.77,M06 KOMPLEKSOWE ZABIEGI DOLNEJ CZĘŚCI UKŁADU ROZRODCZEGO Z PW *,1a,2014,2014
,,4062,4065,1.0,0.06,0.77,8,7,14432.77,283.08,14032.9,271.39,M11 KOMPLEKSOWE ZABIEGI GÓRNEJ CZĘŚCI UKŁADU ROZRODCZEGO BEZ PW *,1a,2014,2014
,,2442,2443,1.0,0.03,0.46,7,5,8980.27,183.78,8771.48,169.35,M12 BARDZO DUŻE ZABIEGI GÓRNEJ CZĘŚCI UKŁADU ROZRODCZEGO BEZ PW *,1a,2014,2014
,,52664,52851,1.0,0.73,9.98,5,5,3607.95,70.25,3557.3,68.87,M13 DUŻE ZABIEGI GÓRNEJ CZĘŚCI UKŁADU ROZRODCZEGO *,1a,2014,2014
