branch,hospital-types,number-of-patients,number-of-hospitalizations,ratio-of-rehospitalizations,percentage,percentage-of-sections,duration-of-hospitalization-mediana,duration-of-hospitalization-mode,average-value-of-hospitalization,average-value-of-hospitalization-points,average-value-of-drg,average-value-of-drg-points,name,catalog,year,period
,,4603,4740,1.03,0.07,1.38,8,4,,,,,A01 ZABIEGI WEWNĄTRZCZASZKOWE Z POWODU POWAŻNEGO URAZU *,1a,2023,2023
,,259,266,1.03,0.0,0.08,7,4,,,,,A02 ZABIEGI WEWNĄTRZCZASZKOWE Z POWODU URAZU *,1a,2023,2023
,,429,518,1.21,0.01,0.15,3,2,,,,,A03 WSZCZEPIENIE STYMULATORA STRUKTUR GŁĘBOKICH MÓZGU/STYMULATORA NERWU BŁĘDNEGO *,1a,2023,2023
,,995,1114,1.12,0.02,0.32,2,2,,,,,A04 WSZCZEPIENIE/WYMIANA STYMULATORA RDZENIA KRĘGOWEGO LUB WYMIANA GENERATORA DO STYMULACJI STRUKTUR GŁĘBOKICH MÓZGU *,1a,2023,2023
,,7573,7826,1.03,0.12,2.27,8,8,,,,,A11 KOMPLEKSOWE ZABIEGI WEWNĄTRZCZASZKOWE *,1a,2023,2023
,,1210,1258,1.04,0.02,0.37,8,8,,,,,A11O KOMPLEKSOWE ZABIEGI WEWNĄTRZCZASZKOWE W ROZPOZNANIACH NOWOTWORÓW ZŁOŚLIWYCH * *,1a,2023,2023
,,3474,3638,1.05,0.05,1.06,7,3,,,,,A12 DUŻE ZABIEGI WEWNĄTRZCZASZKOWE *,1a,2023,2023
,,1037,1071,1.03,0.02,0.31,5,3,,,,,A13 ŚREDNIE ZABIEGI WEWNĄTRZCZASZKOWE *,1a,2023,2023
,,499,510,1.02,0.01,0.15,2,0,,,,,A14 MAŁE ZABIEGI WEWNĄTRZCZASZKOWE *,1a,2023,2023
,,19983,20455,1.02,0.3,5.94,3,3,,,,,A22 DUŻE ZABIEGI NA RDZENIU KRĘGOWYM I W KANALE KRĘGOWYM *,1a,2023,2023
,,1498,1519,1.01,0.02,0.44,3,3,,,,,A23 ŚREDNIE ZABIEGI NA RDZENIU KRĘGOWYM I W KANALE KRĘGOWYM *,1a,2023,2023
,,53,54,1.02,0.0,0.02,2,2,,,,,A24 MAŁE ZABIEGI NA RDZENIU KRĘGOWYM I W KANALE KRĘGOWYM *,1a,2023,2023
,,8565,9542,1.11,0.14,2.77,3,3,,,,,A25 ZABIEGI NA NERWACH OBWODOWYCH *,1a,2023,2023
,,2470,2618,1.06,0.04,0.76,0,0,,,,,A26 ZABIEGI ZWALCZAJĄCE BÓL I NA UKŁADZIE WSPÓŁCZULNYM *,1a,2023,2023
,,2542,2876,1.13,0.04,0.84,1,0,,,,,A27 INNE ZABIEGI NA RDZENIU KRĘGOWYM I W KANALE KRĘGOWYM *,1a,2023,2023
,,5516,5676,1.03,0.08,1.65,5,3,,,,,A30 KOMPLEKSOWA DIAGNOSTYKA POLINEUROPATII I CHORÓB MIĘŚNI,1a,2023,2023
,,7126,7594,1.07,0.11,2.21,4,3,,,,,A31 CHOROBY NERWÓW OBWODOWYCH,1a,2023,2023
,,785,932,1.19,0.01,0.27,6,4,,,,,A32E CHOROBY MIĘŚNI > 65 R.Ż.,1a,2023,2023
,,1133,1363,1.2,0.02,0.4,3,3,,,,,A32F CHOROBY MIĘŚNI < 66 R.Ż.,1a,2023,2023
,,2839,2843,1.0,0.04,0.83,4,3,,,,,A33 ZABURZENIA RÓWNOWAGI,1a,2023,2023
,,3682,4226,1.15,0.06,1.23,2,1,,,,,A34C GUZY MÓZGU I RDZENIA KRĘGOWEGO,1a,2023,2023
,,10506,11173,1.06,0.16,3.25,7,4,,,,,A34D GUZY MÓZGU I RDZENIA KRĘGOWEGO>3 DNI,1a,2023,2023
,,3418,3749,1.1,0.06,1.09,4,0,,,,,A35C CHOROBY ZWYRODNIENIOWE OUN,1a,2023,2023
,,2528,2565,1.01,0.04,0.75,5,4,,,,,A35D CHOROBY ZWYRODNIENIOWE OUN>3 DNI,1a,2023,2023
,,9880,11980,1.21,0.18,3.48,4,4,,,,,A36 CHOROBY DEMIELINIZACYJNE,1a,2023,2023
,,25069,26455,1.06,0.39,7.69,5,3,,,,,A45 CHOROBY NACZYŃ MÓZGOWYCH - LECZENIE ZACHOWAWCZE,1a,2023,2023
,,6934,6999,1.01,0.1,2.03,5,4,,,,,A46 PRZEMIJAJĄCE NIEDOKRWIENIE MÓZGU,1a,2023,2023
,,16761,16903,1.01,0.25,4.91,5,4,,,,,A47 PRZEMIJAJĄCE NIEDOKRWIENIE MÓZGU - ROZSZERZONA DIAGNOSTYKA,1a,2023,2023
,,63804,65493,1.03,0.97,19.03,9,8,,,,,A48 KOMPLEKSOWE LECZENIE UDARÓW MÓZGU > 7 DNI W ODDZIALE UDAROWYM,1a,2023,2023
,,9453,9517,1.01,0.14,2.77,7,4,,,,,A49 UDAR MÓZGU - LECZENIE > 3 DNI,1a,2023,2023
,,9730,10348,1.06,0.15,3.01,2,0,,,,,A50 UDAR MÓZGU - LECZENIE,1a,2023,2023
,,1317,1348,1.02,0.02,0.39,5,3,,,,,A56 CHOROBY NERWÓW CZASZKOWYCH,1a,2023,2023
,,5636,6644,1.18,0.1,1.93,10,3,,,,,A57 CHOROBY ZAPALNE UKŁADU NERWOWEGO,1a,2023,2023
,,287,292,1.02,0.0,0.08,8,7,,,,,A58 ENCEFALOPATIA,1a,2023,2023
,,7110,7173,1.01,0.11,2.08,3,3,,,,,A59 BÓLE GŁOWY,1a,2023,2023
,,4468,4756,1.06,0.07,1.38,4,3,,,,,A66 PADACZKA - DIAGNOSTYKA I LECZENIE,1a,2023,2023
,,6945,7168,1.03,0.11,2.08,6,4,,,,,A67 PADACZKA - DIAGNOSTYKA I LECZENIE > 3 DNI,1a,2023,2023
,,3940,3985,1.01,0.06,1.16,4,3,,,,,A76 URAZY GŁOWY Z ISTOTNYM USZKODZENIEM MÓZGU LECZONE ZACHOWAWCZO,1a,2023,2023
,,3586,3606,1.01,0.05,1.05,1,1,,,,,A77 URAZY GŁOWY BEZ ISTOTNEGO USZKODZENIA MÓZGU LECZONE ZACHOWAWCZO,1a,2023,2023
,,1167,1416,1.21,0.02,0.41,4,0,,,,,A86 CHOROBY NEURONU RUCHOWEGO,1a,2023,2023
,,59635,61919,1.04,0.91,17.99,4,3,,,,,A87 INNE CHOROBY UKŁADU NERWOWEGO,1a,2023,2023
,,161,166,1.03,0.0,0.03,4,3,,,,,B04 PRZESZCZEP ROGÓWKI - KATEGORIA I *,1a,2023,2023
,,1084,1194,1.1,0.02,0.24,3,3,,,,,B05 PRZESZCZEP ROGÓWKI - KATEGORIA II *,1a,2023,2023
,,29,29,1.0,0.0,0.01,2,2,,,,,B06 PRZESZCZEP ROGÓWKI - KATEGORIA III *,1a,2023,2023
,,2338,2759,1.18,0.04,0.56,0,0,,,,,B11 KOMPLEKSOWE ZABIEGI W ZAĆMIE I JASKRZE *,1a,2023,2023
,,8889,10535,1.19,0.16,2.14,2,2,,,,,"B16 ZABIEGI Z WYKONANIEM WITREKTOMII Z UŻYCIEM OLEJU SILIKONOWEGO LUB DEKALINY, W TYM WIELOPROCEDURALNE *",1a,2023,2023
,,3167,3226,1.02,0.05,0.65,2,2,,,,,"B16G ZABIEGI Z WYKONANIEM FAKOWITREKTOMII Z UŻYCIEM OLEJU SILIKONOWEGO LUB DEKALINY, W TYM WIELOPROCEDURALNE *",1a,2023,2023
,,10352,11037,1.07,0.16,2.24,1,0,,,,,"B17 ZABIEGI Z WYKONANIEM WITREKTOMII, W TYM WIELOPROCEDURALNE *",1a,2023,2023
,,3627,3737,1.03,0.06,0.76,0,0,,,,,"B17G ZABIEGI Z WYKONANIEM FAKOWITREKTOMII, W TYM WIELOPROCEDURALNE *",1a,2023,2023
,,17639,20379,1.16,0.3,4.13,0,0,,,,,B18G USUNIĘCIE ZAĆMY - KATEGORIA I *,1a,2023,2023
,,232591,306296,1.32,4.52,62.08,0,0,,,,,B19G USUNIĘCIE ZAĆMY - KATEGORIA II *,1a,2023,2023
,,900,927,1.03,0.01,0.19,0,0,,,,,B23 ŚREDNIE ZABIEGI NA SOCZEWCE *,1a,2023,2023
,,712,724,1.02,0.01,0.15,0,0,,,,,B25 WSZCZEPIENIE WTÓRNE SOCZEWKI *,1a,2023,2023
,,1088,1165,1.07,0.02,0.24,1,0,,,,,B31 DUŻE REKONSTRUKCJE NA APARACIE OCHRONNYM OKA *,1a,2023,2023
,,4271,4916,1.15,0.07,1.0,0,0,,,,,B32 DUŻE ZABIEGI NA APARACIE OCHRONNYM OKA *,1a,2023,2023
,,11117,13355,1.2,0.2,2.71,0,0,,,,,B33 ŚREDNIE ZABIEGI NA APARACIE OCHRONNYM OKA *,1a,2023,2023
,,1043,1071,1.03,0.02,0.22,2,2,,,,,B42 DUŻE ZABIEGI NA OCZODOLE I APARACIE ŁZOWYM *,1a,2023,2023
,,3278,3992,1.22,0.06,0.81,0,0,,,,,B43 ŚREDNIE ZABIEGI NA OCZODOLE I APARACIE ŁZOWYM *,1a,2023,2023
,,1868,2179,1.17,0.03,0.44,1,0,,,,,B52 DUŻE ZABIEGI NA ROGÓWCE I TWARDÓWCE *,1a,2023,2023
,,1463,1549,1.06,0.02,0.31,0,0,,,,,B53 ŚREDNIE ZABIEGI NA ROGÓWCE I TWARDÓWCE *,1a,2023,2023
,,2859,2944,1.03,0.04,0.6,1,0,,,,,B63 ZABIEGI W ZAKRESIE MIĘŚNI OKORUCHOWYCH *,1a,2023,2023
,,4582,5584,1.22,0.08,1.13,1,0,,,,,B72 DUŻE ZABIEGI W JASKRZE I NA NACZYNIÓWCE *,1a,2023,2023
,,3009,3535,1.17,0.05,0.72,0,0,,,,,B73 ŚREDNIE ZABIEGI W JASKRZE I NA NACZYNIÓWCE *,1a,2023,2023
,,427,449,1.05,0.01,0.09,0,0,,,,,B74 MAŁE ZABIEGI W JASKRZE I NA NACZYNIÓWCE *,1a,2023,2023
,,645,656,1.02,0.01,0.13,2,2,,,,,B81 DUŻE ZABIEGI NA SIATKÓWCE *,1a,2023,2023
,,17,17,1.0,0.0,0.0,1,0,,,,,B83 ŚREDNIE ZABIEGI WITREORETINALNE *,1a,2023,2023
,,28617,74710,2.61,1.1,15.14,0,0,,,,,B84 MAŁE ZABIEGI WITREORETINALNE *,1a,2023,2023
,,5679,6001,1.06,0.09,1.22,0,0,,,,,B94 INNE PROCEDURY W ZAKRESIE OKA *,1a,2023,2023
,,9385,10212,1.09,0.15,2.07,4,3,,,,,B98A LECZENIE ZACHOWAWCZE OKULISTYCZNE > 17 R.Ż.,1a,2023,2023
,,1553,1559,1.0,0.02,0.72,15,11,,,,,"C01 ROZLEGŁE OPERACJE NOWOTWORÓW JAMY USTNEJ, GARDŁA I KRTANI Z REKONSTRUKCJĄ *",1a,2023,2023
,,1235,1253,1.01,0.02,0.58,4,4,,,,,C05G LECZENIE ZABURZEŃ SŁUCHU ZA POMOCĄ IMPLANTÓW ŚLIMAKOWYCH *,1a,2023,2023
,,94,94,1.0,0.0,0.04,3,3,,,,,C06G LECZENIE ZABURZEŃ SŁUCHU ZA POMOCĄ IMPLANTÓW UCHA ŚRODKOWEGO *,1a,2023,2023
,,168,170,1.01,0.0,0.08,2,2,,,,,C06H LECZENIE ZABURZEŃ SŁUCHU ZA POMOCĄ INNYCH WSZCZEPIALNYCH ELEKTRONICZNYCH PROTEZ SŁUCHU *,1a,2023,2023
,,1552,1600,1.03,0.02,0.74,0,0,,,,,C07G WYMIANA PROCESORA MOWY IMPLANTÓW ŚLIMAKOWYCH I DO PNIA MÓZGU *,1a,2023,2023
,,13,13,1.0,0.0,0.01,0,0,,,,,C07H WYMIANA PROCESORA MOWY IMPLANTÓW UCHA ŚRODKOWEGO *,1a,2023,2023
,,135,138,1.02,0.0,0.06,0,0,,,,,C07I WYMIANA PRZETWORNIKA MOWY IMPLANTÓW NA PRZEWODNICTWO KOSTNE *,1a,2023,2023
,,6739,7114,1.06,0.1,3.28,3,2,,,,,"C11 KOMPLEKSOWE ZABIEGI JAMY USTNEJ, GARDŁA I KRTANI *",1a,2023,2023
,,223,232,1.04,0.0,0.11,7,2,,,,,"C11O KOMPLEKSOWE ZABIEGI JAMY USTNEJ, GARDŁA I KRTANI W ROZPOZNANIACH NOWOTWORÓW ZŁOŚLIWYCH* *",1a,2023,2023
,,14862,17832,1.2,0.26,8.22,2,0,,,,,"C12 DUŻE ZABIEGI JAMY USTNEJ, GARDŁA I KRTANI *",1a,2023,2023
,,36289,37240,1.03,0.55,17.17,2,2,,,,,"C14 ŚREDNIE ZABIEGI JAMY USTNEJ, GARDŁA I KRTANI",1a,2023,2023
,,3586,3664,1.02,0.05,1.69,0,0,,,,,"C15 MAŁE ZABIEGI JAMY USTNEJ, GARDŁA I KRTANI *",1a,2023,2023
,,259,262,1.01,0.0,0.12,8,3,,,,,C21E KOMPLEKSOWE ZABIEGI SZCZĘKOWO-TWARZOWE > 65 R.Ż. *,1a,2023,2023
,,2643,2660,1.01,0.04,1.23,3,3,,,,,C21F KOMPLEKSOWE ZABIEGI SZCZĘKOWO-TWARZOWE < 66 R.Ż. *,1a,2023,2023
,,13414,14012,1.04,0.21,6.46,2,2,,,,,C22 DUŻE ZABIEGI SZCZĘKOWO-TWARZOWE *,1a,2023,2023
,,712,738,1.04,0.01,0.34,1,0,,,,,C23 ŚREDNIE ZABIEGI SZCZĘKOWO-TWARZOWE *,1a,2023,2023
,,1475,1682,1.14,0.02,0.78,1,0,,,,,C24 MAŁE ZABIEGI SZCZĘKOWO-TWARZOWE *,1a,2023,2023
,,78,81,1.04,0.0,0.04,1,1,,,,,"C27 DUŻE ZABIEGI KOREKCYJNE WAD WRODZONYCH TWARZOCZASZKI, JAMY USTNEJ I GARDŁA < 18 R.Ż *",1a,2023,2023
,,25,25,1.0,0.0,0.01,3,3,,,,,"C28 ŚREDNIE ZABIEGI KOREKCYJNE WAD WRODZONYCH TWARZOCZASZKI, JAMY USTNEJ I GARDŁA < 18 R.Ż *",1a,2023,2023
,,1690,1695,1.0,0.02,0.78,0,0,,,,,"C29 MAŁE ZABIEGI KOREKCYJNE WAD WRODZONYCH TWARZOCZASZKI, JAMY USTNEJ I GARDŁA < 18 R.Ż *",1a,2023,2023
,,5723,5939,1.04,0.09,2.74,3,3,,,,,C31 KOMPLEKSOWE ZABIEGI USZU *,1a,2023,2023
,,4168,4258,1.02,0.06,1.96,2,2,,,,,C32 DUŻE ZABIEGI USZU *,1a,2023,2023
,,459,466,1.02,0.01,0.21,1,0,,,,,C33 ŚREDNIE ZABIEGI USZU *,1a,2023,2023
,,1965,2051,1.04,0.03,0.95,0,0,,,,,C34 MAŁE ZABIEGI USZU *,1a,2023,2023
,,20408,20586,1.01,0.3,9.49,3,3,,,,,C41 KOMPLEKSOWE ZABIEGI NOSA *,1a,2023,2023
,,21536,21614,1.0,0.32,9.97,2,3,,,,,C42 DUŻE ZABIEGI NOSA *,1a,2023,2023
,,7356,7473,1.02,0.11,3.45,0,0,,,,,C43 ŚREDNIE ZABIEGI NOSA *,1a,2023,2023
,,4956,5036,1.02,0.07,2.32,0,0,,,,,C44 MAŁE ZABIEGI NOSA *,1a,2023,2023
,,11624,13335,1.15,0.2,6.15,2,0,,,,,"C56 POWAŻNE CHOROBY GARDŁA, USZU I NOSA",1a,2023,2023
,,40659,42819,1.05,0.63,19.74,2,0,,,,,"C57 INNE CHOROBY GARDŁA, USZU I NOSA",1a,2023,2023
,,1198,1222,1.02,0.02,0.56,0,0,,,,,"C64 INNE PROCEDURY JAMY USTNEJ, GARDŁA, KRTANI, NOSA I USZU *",1a,2023,2023
,,4644,4665,1.0,0.07,1.25,8,7,,,,,D01 ZŁOŻONE ZABIEGI KLATKI PIERSIOWEJ *,1a,2023,2023
,,7308,7562,1.03,0.11,2.02,7,7,,,,,D02 KOMPLEKSOWE ZABIEGI KLATKI PIERSIOWEJ *,1a,2023,2023
,,5923,6104,1.03,0.09,1.63,6,4,,,,,D03 DUŻE ZABIEGI KLATKI PIERSIOWEJ *,1a,2023,2023
,,6550,6844,1.04,0.1,1.83,1,0,,,,,D05 BRONCHOSKOPIA *,1a,2023,2023
,,21491,23926,1.11,0.35,6.4,2,0,,,,,D06 ŚREDNIE ZABIEGI KLATKI PIERSIOWEJ *,1a,2023,2023
,,7283,7746,1.06,0.11,2.07,2,1,,,,,D07 MAŁE ZABIEGI KLATKI PIERSIOWEJ *,1a,2023,2023
,,7104,7980,1.12,0.12,2.14,7,7,,,,,D10E DYCHAWICA OSKRZELOWA > 65 R.Ż.,1a,2023,2023
,,14774,16286,1.1,0.24,4.36,3,0,,,,,D10F DYCHAWICA OSKRZELOWA < 66 R.Ż.,1a,2023,2023
,,17412,18068,1.04,0.27,4.83,7,7,,,,,D16 ZATOR PŁUCNY,1a,2023,2023
,,3219,3902,1.21,0.06,1.04,11,7,,,,,"D17 ROPIEŃ PŁUC, ROPOWICA",1a,2023,2023
,,24479,25070,1.02,0.37,6.71,8,7,,,,,"D18 ZAPALENIE PŁUC NIETYPOWE, WIRUSOWE",1a,2023,2023
,,4420,5092,1.15,0.08,1.36,7,5,,,,,D19 ROZSTRZENIE OSKRZELI,1a,2023,2023
,,700,835,1.19,0.01,0.22,4,3,,,,,D20 GRUŹLICA,1a,2023,2023
,,1775,3749,2.11,0.06,1.0,0,0,,,,,D21 ZWŁÓKNIENIE TORBIELOWATE,1a,2023,2023
,,6641,7694,1.16,0.11,2.06,7,7,,,,,D26 WYSIĘKOWE ZAPALENIE OPŁUCNEJ,1a,2023,2023
,,43630,58075,1.33,0.86,15.54,5,5,,,,,D28 CHOROBY NOWOTWOROWE UKŁADU ODDECHOWEGO I KLATKI PIERSIOWEJ,1a,2023,2023
,,26996,28607,1.06,0.42,7.65,1,1,,,,,D36 ZABURZENIA ODDYCHANIA W CZASIE SNU,1a,2023,2023
,,6155,6542,1.06,0.1,1.75,5,3,,,,,D37E INNE CHOROBY UKŁADU ODDECHOWEGO > 65 R.Ż.,1a,2023,2023
,,8232,8660,1.05,0.13,2.32,3,3,,,,,D37F INNE CHOROBY UKŁADU ODDECHOWEGO < 66 R.Ż.,1a,2023,2023
,,785,795,1.01,0.01,0.21,5,1,,,,,D38 OBRZĘK PŁUC,1a,2023,2023
,,2495,2921,1.17,0.04,0.78,10,3,,,,,D45 LECZENIE NIEWYDOLNOŚCI ODDYCHANIA PRZY ZASTOSOWANIU NIEINWAZYJNEJ WENTYLACJI MECHANICZNEJ (NWM) >17R.Ż.,1a,2023,2023
,,31620,34138,1.08,0.5,9.13,5,3,,,,,D46 POCHP I INNE OBTURACYJNE CHOROBY UKŁADU ODDECHOWEGO,1a,2023,2023
,,1,1,1.0,0.0,0.0,14,14,,,,,D47 ZAPALENIE PŁUC Z PW,1a,2023,2023
,,24877,25467,1.02,0.38,6.81,7,7,,,,,D48 ZAPALENIE PŁUC BEZ PW,1a,2023,2023
,,3396,3493,1.03,0.05,0.93,7,2,,,,,D49 USZKODZENIA INHALACYJNE PŁUC,1a,2023,2023
,,19727,24223,1.23,0.36,6.48,5,3,,,,,D50 ZWŁÓKNIENIE I PYLICA PŁUC,1a,2023,2023
,,4094,4375,1.07,0.06,1.17,6,5,,,,,D51 ODMA OPŁUCNOWA,1a,2023,2023
,,17681,19468,1.1,0.29,5.21,7,7,,,,,D52 NIEWYDOLNOŚĆ ODDECHOWA,1a,2023,2023
,,468,597,1.28,0.01,0.16,5,0,,,,,D53 NADCIŚNIENIE PŁUCNE > 17 R.Ż.,1a,2023,2023
,,90,90,1.0,0.0,0.02,6,6,,,,,D54 ZAPALENIE OPŁUCNEJ,1a,2023,2023
,,6861,10801,1.57,0.16,2.89,3,3,,,,,"D55 ZIARNINIAKI, CHOROBY PŁUC ALERGICZNE I Z AUTOIMMUNIZACJI",1a,2023,2023
,,1788,1838,1.03,0.03,0.25,7,3,,,,,E02 INNE ZABIEGI KARDIOCHIRURGICZNE > 17 R.Ż. *,1a,2023,2023
,,431,431,1.0,0.01,0.06,14,10,,,,,E04 POMOSTOWANIE NACZYŃ WIEŃCOWYCH Z PLASTYKĄ *,1a,2023,2023
,,1621,1621,1.0,0.02,0.22,10,7,,,,,E05G POMOSTOWANIE NACZYŃ WIEŃCOWYCH Z PW >=2* *,1a,2023,2023
,,7145,7145,1.0,0.11,0.97,9,8,,,,,E06G POMOSTOWANIE NACZYŃ WIEŃCOWYCH BEZ PW * *,1a,2023,2023
,,9407,9459,1.01,0.14,1.28,4,3,,,,,E10 OZW - DIAGNOSTYKA INWAZYJNA *,1a,2023,2023
,,13156,13175,1.0,0.19,1.78,5,4,,,,,E11 OZW - LECZENIE INWAZYJNE DWUETAPOWE > 3 DNI *,1a,2023,2023
,,38616,39457,1.02,0.58,5.34,4,4,,,,,E12G OZW - LECZENIE INWAZYJNE *,1a,2023,2023
,,3311,3346,1.01,0.05,0.45,10,8,,,,,E15 OZW - LECZENIE INWAZYJNE > 7 DNI Z PW *,1a,2023,2023
,,6722,6888,1.02,0.1,0.93,4,1,,,,,E16 OZW > 69 R.Ż. LUB Z PW,1a,2023,2023
,,3314,3364,1.02,0.05,0.45,2,1,,,,,E17G OZW - LECZENIE ZACHOWAWCZE,1a,2023,2023
,,2873,2894,1.01,0.04,0.39,2,2,,,,,E21 PRZEZSKÓRNE ZAMKNIĘCIE NIEPRAWIDŁOWYCH POŁĄCZEŃ WEWNĄTRZSERCOWYCH I ZEWNĄTRZSERCOWYCH > 17 R.Ż. *,1a,2023,2023
,,554,560,1.01,0.01,0.08,7,3,,,,,E22E PRZEZSKÓRNE WALWULOPLASTYKI > 65 R.Ż. *,1a,2023,2023
,,75,76,1.01,0.0,0.01,4,4,,,,,E22F PRZEZSKÓRNE WALWULOPLASTYKI > 17 R.Ż. I < 66 R.Ż. *,1a,2023,2023
,,30535,33346,1.09,0.49,4.51,2,1,,,,,E23G ANGIOPLASTYKA WIEŃCOWA Z IMPLANTACJĄ JEDNEGO STENTU *,1a,2023,2023
,,20539,22635,1.1,0.33,3.06,2,1,,,,,E24G ANGIOPLASTYKA WIEŃCOWA Z IMPLANTACJĄ NIE MNIEJ NIŻ 2 STENTÓW LUB WIELONACZYNIOWA *,1a,2023,2023
,,2775,2892,1.04,0.04,0.39,2,1,,,,,E26 ANGIOPLASTYKA WIEŃCOWA BALONOWA *,1a,2023,2023
,,96271,97862,1.02,1.44,13.23,1,1,,,,,E27 KORONAROGRAFIA I INNE ZABIEGI INWAZYJNE *,1a,2023,2023
,,3803,4006,1.05,0.06,0.54,2,1,,,,,E29 ANGIOPLASTYKA WIEŃCOWA BALONOWA (DEB) *,1a,2023,2023
,,7388,7401,1.0,0.11,1.0,2,2,,,,,E31 WSZCZEPIENIE/ WYMIANA ROZRUSZNIKA JEDNOJAMOWEGO *,1a,2023,2023
,,26865,26895,1.0,0.4,3.64,2,2,,,,,E32 WSZCZEPIENIE/ WYMIANA ROZRUSZNIKA DWUJAMOWEGO *,1a,2023,2023
,,1310,1311,1.0,0.02,0.18,3,2,,,,,E33 WSZCZEPIENIE/ WYMIANA UKŁADU Z FUNKCJĄ RESYNCHRONIZUJĄCĄ SERCA (CRT) *,1a,2023,2023
,,7422,7440,1.0,0.11,1.01,2,2,,,,,E34 WSZCZEPIENIE/ WYMIANA KARDIOWERTERA-DEFIBRYLATORA JEDNO-/ DWUJAMOWEGO *,1a,2023,2023
,,374,374,1.0,0.01,0.05,5,2,,,,,E34G WSZCZEPIENIE LUB WYMIANA CAŁKOWICIE PODSKÓRNEGO KARDIOWERTERA-DEFIBRYLATORA *,1a,2023,2023
,,4829,4858,1.01,0.07,0.66,3,2,,,,,E36 WSZCZEPIENIE/ WYMIANA CRT-D > 17 R.Ż. *,1a,2023,2023
,,1109,1147,1.03,0.02,0.16,3,2,,,,,E37 REPERACJA/ REPOZYCJA/ REWIZJA/ WYMIANA ELEKTRODY/ UKŁADU STYMULUJĄCEGO/ KARDIOWERTERA-DEFIBRYLATORA *,1a,2023,2023
,,48,48,1.0,0.0,0.01,4,2,,,,,E37G WYMIANA ELEKTROD DO CAŁKOWITEGO AUTOMATYCZNEGO SYSTEMU DO KARDIOWERSJI LUB DEFIBRYLACJI [ICD)]- JEDNOJAMOWEGO LUB DWUJAMOWEGO,1a,2023,2023
,,56,56,1.0,0.0,0.01,4,2,,,,,E37H WYMIANA ELEKTROD DO CAŁKOWITEGO AUTOMATYCZNEGO SYSTEMU DO KARDIOWERSJI LUB DEFIBRYLACJI Z FUNKCJĄ RESYNCHRONIZACJI [CRT-D],1a,2023,2023
,,7253,7400,1.02,0.11,1.0,2,2,,,,,E43 ABLACJA ZABURZEŃ RYTMU *,1a,2023,2023
,,2269,2281,1.01,0.03,0.31,2,2,,,,,E44 DIAGNOSTYKA INWAZYJNA ZABURZEŃ RYTMU SERCA *,1a,2023,2023
,,3286,3395,1.03,0.05,0.46,2,2,,,,,E46 ABLACJA (PROSTA) ZABURZEŃ RYTMU Z WYKORZYSTANIEM SYSTEMU ELEKTROANATOMICZNEGO 3D *,1a,2023,2023
,,6245,6435,1.03,0.1,0.87,2,2,,,,,E47 ABLACJA (ZŁOŻONA) ZABURZEŃ RYTMU Z WYKORZYSTANIEM SYSTEMU ELEKTROANATOMICZNEGO 3D *,1a,2023,2023
,,11513,11649,1.01,0.17,1.58,2,2,,,,,E48 ABLACJA MIGOTANIA PRZEDSIONKÓW - IZOLACJA ŻYŁ PŁUCNYCH *,1a,2023,2023
,,12221,13205,1.08,0.19,1.79,8,7,,,,,E50 OSTRA LUB ZDEKOMPENSOWANA NIEWYDOLNOŚC KRĄŻENIA - LECZENIE W OINK,1a,2023,2023
,,1369,1604,1.17,0.02,0.22,21,3,,,,,E51 ZAPALENIE WSIERDZIA,1a,2023,2023
,,30043,32191,1.07,0.48,4.35,7,7,,,,,E52 ZAAWANSOWANA NIEWYDOLNOŚĆ KRĄŻENIA,1a,2023,2023
,,160305,186953,1.17,2.76,25.28,6,6,,,,,E53G NIEWYDOLNOŚĆ KRĄŻENIA,1a,2023,2023
,,3424,3490,1.02,0.05,0.47,5,4,,,,,E55 ZAKRZEPICA ŻYŁ GŁĘBOKICH,1a,2023,2023
,,17922,18646,1.04,0.28,2.52,4,3,,,,,E56 CHOROBA NIEDOKRWIENNA SERCA > 69 R.Ż. LUB Z PW,1a,2023,2023
,,10419,10763,1.03,0.16,1.46,3,3,,,,,E57 CHOROBA NIEDOKRWIENNA SERCA > 17 R.Ż. < 70 R.Ż. BEZ PW,1a,2023,2023
,,1824,1830,1.0,0.03,0.25,2,1,,,,,E59 NAGŁE ZATRZYMANIE KRĄŻENIA,1a,2023,2023
,,28065,32201,1.15,0.48,4.35,2,1,,,,,E61 ZABURZENIA RYTMU SERCA > 69 R.Ż. LUB Z PW,1a,2023,2023
,,20256,23022,1.14,0.34,3.11,2,1,,,,,E62 ZABURZENIA RYTMU SERCA > 17 R.Ż. < 70 R.Ż. BEZ PW,1a,2023,2023
,,5954,6095,1.02,0.09,0.82,3,3,,,,,E71 OMDLENIE I ZAPAŚĆ,1a,2023,2023
,,2610,2633,1.01,0.04,0.36,2,0,,,,,E72 NIEINWAZYJNA DIAGNOSTYKA BÓLU W KLATCE PIERSIOWEJ >17 R.Ż.,1a,2023,2023
,,15702,16737,1.07,0.25,2.26,4,3,,,,,E73 CHOROBY ZASTAWEK SERCA > 17 R.Ż.,1a,2023,2023
,,533,583,1.09,0.01,0.08,2,0,,,,,E74E WRODZONE WADY SERCA > 65 R.Ż.,1a,2023,2023
,,3527,3931,1.11,0.06,0.53,1,0,,,,,E74F WRODZONE WADY SERCA > 17 R.Ż. I < 66 R.Ż.,1a,2023,2023
,,16253,17200,1.06,0.25,2.33,4,3,,,,,E77 INNE CHOROBY UKŁADU KRĄŻENIA > 17 R.Ż.,1a,2023,2023
,,767,773,1.01,0.01,0.1,9,8,,,,,E86 NADCIŚNIENIE TĘTNICZE OPORNE I WTÓRNE,1a,2023,2023
,,995,1019,1.02,0.02,0.14,4,3,,,,,E87 CIĘŻKIE NADCIŚNIENIE TĘTNICZE > 17 R.Ż.,1a,2023,2023
,,33470,34496,1.03,0.51,4.67,3,3,,,,,E88 NADCIŚNIENIE TĘTNICZE > 17 R.Ż.,1a,2023,2023
,,398,398,1.0,0.01,0.05,1,1,,,,,E89 KOMPLEKSOWA DIAGNOSTYKA KARDIOLOGICZNA,1a,2023,2023
,,615,621,1.01,0.01,0.1,15,10,,,,,F01 KOMPLEKSOWE ZABIEGI PRZEŁYKU *,1a,2023,2023
,,2829,3384,1.2,0.05,0.57,3,2,,,,,"F02 DUŻE ZABIEGI PRZEŁYKU, W TYM PROTEZOWANIE *",1a,2023,2023
,,3019,4392,1.45,0.06,0.74,2,0,,,,,F03 ŚREDNIE I ENDOSKOPOWE ZABIEGI PRZEŁYKU *,1a,2023,2023
,,7279,7466,1.03,0.11,1.26,1,0,,,,,F04 DIAGNOSTYCZNE I MAŁE  ZABIEGI PRZEWODU POKARMOWEGO *,1a,2023,2023
,,7978,8484,1.06,0.13,1.43,3,3,,,,,F07E CHOROBY PRZEŁYKU > 65 R.Ż.,1a,2023,2023
,,10856,11628,1.07,0.17,1.96,2,2,,,,,F07F CHOROBY PRZEŁYKU < 66 R.Ż.,1a,2023,2023
,,1274,1276,1.0,0.02,0.22,13,9,,,,,F11E KOMPLEKSOWE ZABIEGI ŻOŁĄDKA I DWUNASTNICY > 65 R.Ż. *,1a,2023,2023
,,1001,1004,1.0,0.01,0.17,10,8,,,,,F11F KOMPLEKSOWE ZABIEGI ŻOŁĄDKA I DWUNASTNICY < 66 R.Ż. *,1a,2023,2023
,,7105,7211,1.01,0.11,1.22,6,5,,,,,F12 DUŻE ZABIEGI ŻOŁĄDKA I DWUNASTNICY *,1a,2023,2023
,,9015,9419,1.04,0.14,1.59,1,0,,,,,F13 ZABIEGI LECZNICZE ŻOŁĄDKA I DWUNASTNICY *,1a,2023,2023
,,6487,6510,1.0,0.1,1.1,3,3,,,,,F14 CHIRURGICZNE LECZENIE OTYŁOŚCI *,1a,2023,2023
,,16776,17818,1.06,0.26,3.0,3,3,,,,,F16E CHOROBY ŻOŁĄDKA I DWUNASTNICY > 65 R.Ż. *,1a,2023,2023
,,19825,20745,1.05,0.31,3.5,3,3,,,,,F16F CHOROBY ŻOŁĄDKA I DWUNASTNICY < 66 R.Ż. *,1a,2023,2023
,,6269,6336,1.01,0.09,1.07,10,7,,,,,F21 KOMPLEKSOWE ZABIEGI JELITA CIENKIEGO *,1a,2023,2023
,,9836,9940,1.01,0.15,1.68,6,2,,,,,F22 DUŻE I ENDOSKOPOWE ZABIEGI JELITA CIENKIEGO *,1a,2023,2023
,,2009,2143,1.07,0.03,0.36,4,1,,,,,F26E CHOROBY JELITA CIENKIEGO (BEZ CHORÓB ZAPALNYCH) > 65 R.Ż,1a,2023,2023
,,1865,2031,1.09,0.03,0.34,3,1,,,,,F26F CHOROBY JELITA CIENKIEGO (BEZ CHORÓB ZAPALNYCH) < 66 R.Ż.,1a,2023,2023
,,18771,18843,1.0,0.28,3.18,8,7,,,,,F31 KOMPLEKSOWE ZABIEGI JELITA GRUBEGO *,1a,2023,2023
,,10942,11386,1.04,0.17,1.92,4,2,,,,,F32 DUŻE I ENDOSKOPOWE ZABIEGI JELITA GRUBEGO *,1a,2023,2023
,,1802,1846,1.02,0.03,0.31,6,7,,,,,F32O DUŻE I ENDOSKOPOWE ZABIEGI JELITA GRUBEGO W ROZPOZNANIACH NOWOTWORÓW ZŁOŚLIWYCH* *,1a,2023,2023
,,74776,77118,1.03,1.14,13.0,1,0,,,,,F34 ŚREDNIE I ENDOSKOPOWE ZABIEGI PRZEWODU POKARMOWEGO *,1a,2023,2023
,,42654,47374,1.11,0.7,7.99,3,1,,,,,F36 CHOROBY JELITA GRUBEGO,1a,2023,2023
,,29731,30005,1.01,0.44,5.06,4,3,,,,,F42 DUŻE ZABIEGI JAMY BRZUSZNEJ *,1a,2023,2023
,,677,687,1.01,0.01,0.12,8,7,,,,,F42O DUŻE ZABIEGI JAMY BRZUSZNEJ W ROZPOZNANIACH NOWOTWORÓW ZŁOŚLIWYCH* *,1a,2023,2023
,,3963,4203,1.06,0.06,0.71,6,2,,,,,F43E ŚREDNIE I ENDOSKOPOWE LECZNICZE ZABIEGI JAMY BRZUSZNEJ > 65 R.Ż. *,1a,2023,2023
,,6748,7044,1.04,0.1,1.19,3,2,,,,,F43F ŚREDNIE I ENDOSKOPOWE LECZNICZE ZABIEGI JAMY BRZUSZNEJ < 66 R.Ż. *,1a,2023,2023
,,1716,1774,1.03,0.03,0.3,1,1,,,,,F44 DIAGNOSTYCZNE  I LECZNICZE ZABIEGI JAMY BRZUSZNEJ *,1a,2023,2023
,,61491,64415,1.05,0.95,10.86,3,3,,,,,F46 CHOROBY JAMY BRZUSZNEJ,1a,2023,2023
,,827,838,1.01,0.01,0.14,7,7,,,,,F47E CHOROBY INFEKCYJNE JELIT > 65 R.Ż.,1a,2023,2023
,,1430,1452,1.02,0.02,0.24,5,4,,,,,F47F CHOROBY INFEKCYJNE JELIT < 66 R.Ż.,1a,2023,2023
,,132,134,1.02,0.0,0.02,11,6,,,,,F51 KOMPLEKSOWE ZABIEGI W CHOROBACH ZAPALNYCH JELIT *,1a,2023,2023
,,1554,1723,1.11,0.03,0.29,2,2,,,,,F52 DUŻE I ENDOSKOPOWE ZABIEGI W CHOROBACH ZAPALNYCH JELIT *,1a,2023,2023
,,15269,17189,1.13,0.25,2.9,9,3,,,,,F58E CHOROBY ZAPALNE JELIT > 65 R.Ż,1a,2023,2023
,,16289,19550,1.2,0.29,3.3,4,0,,,,,F58F CHOROBY ZAPALNE JELIT < 66 R.Ż.,1a,2023,2023
,,184,186,1.01,0.0,0.03,13,5,,,,,F61 KOMPLEKSOWE ZABIEGI W KRWAWIENIACH Z PRZEWODU POKARMOWEGO *,1a,2023,2023
,,11616,12185,1.05,0.18,2.05,5,4,,,,,F62 DUŻE I ENDOSKOPOWE LECZNICZE ZABIEGI W KRWAWIENIACH Z PRZEWODU POKARMOWEGO *,1a,2023,2023
,,10360,10713,1.03,0.16,1.81,4,3,,,,,F66 KRWAWIENIA Z PRZEWODU POKARMOWEGO - LECZENIE ZACHOWAWCZE,1a,2023,2023
,,81174,82704,1.02,1.22,13.94,2,2,,,,,F72 OPERACJE PRZEPUKLIN JAMY BRZUSZNEJ Z WSZCZEPEM *,1a,2023,2023
,,16442,16514,1.0,0.24,2.78,2,2,,,,,F73 OPERACJE PRZEPUKLIN BRZUSZNYCH *,1a,2023,2023
,,4901,4902,1.0,0.07,0.83,4,3,,,,,F82 WYCIĘCIE WYROSTKA ROBACZKOWEGO Z POWIKŁANIAMI *,1a,2023,2023
,,14768,14768,1.0,0.22,2.49,3,3,,,,,F83 WYCIĘCIE WYROSTKA ROBACZKOWEGO *,1a,2023,2023
,,292,300,1.03,0.0,0.05,6,6,,,,,F86E CHOROBY WYROSTKA ROBACZKOWEGO > 65 R.Ż.,1a,2023,2023
,,602,613,1.02,0.01,0.1,4,3,,,,,F86F CHOROBY WYROSTKA ROBACZKOWEGO < 66 R.Ż.,1a,2023,2023
,,16522,17271,1.05,0.25,2.91,2,2,,,,,F93 ŚREDNIE ZABIEGI ODBYTU *,1a,2023,2023
,,4417,4502,1.02,0.07,0.76,2,2,,,,,F94 MAŁE ZABIEGI ODBYTU I ODBYTNICY *,1a,2023,2023
,,2044,2206,1.08,0.03,0.37,4,2,,,,,F96 CHOROBY ODBYTU,1a,2023,2023
,,952,964,1.01,0.01,0.37,7,7,,,,,G01 ROZLEGŁE ZABIEGI WĄTROBY *,1a,2023,2023
,,1752,2067,1.18,0.03,0.79,4,2,,,,,G11 KOMPLEKSOWE ZABIEGI WĄTROBY *,1a,2023,2023
,,98,99,1.01,0.0,0.04,5,2,,,,,G12 DUŻE ZABIEGI WĄTROBY *,1a,2023,2023
,,359,366,1.02,0.01,0.14,4,1,,,,,G13 ŚREDNIE ZABIEGI WĄTROBY *,1a,2023,2023
,,1927,2018,1.05,0.03,0.77,1,1,,,,,G14 MAŁE ZABIEGI WĄTROBY *,1a,2023,2023
,,6929,7773,1.12,0.11,2.98,4,3,,,,,G16 OSTRE CHOROBY WĄTROBY,1a,2023,2023
,,25474,28476,1.12,0.42,10.94,8,6,,,,,G17 PRZEWLEKŁE CHOROBY WĄTROBY Z PW >5 DNI,1a,2023,2023
,,21485,24148,1.12,0.36,9.27,3,3,,,,,G18 PRZEWLEKŁE CHOROBY WĄTROBY BEZ PW,1a,2023,2023
,,759,812,1.07,0.01,0.31,11,3,,,,,G21 KOMPLEKSOWE ZABIEGI PRZEWODÓW ŻÓŁCIOWYCH *,1a,2023,2023
,,2010,2018,1.0,0.03,0.77,3,2,,,,,G22 DUŻE ZABIEGI PRZEWODÓW ŻÓŁCIOWYCH *,1a,2023,2023
,,23868,23881,1.0,0.35,9.17,3,2,,,,,G25E WYCIĘCIE PĘCHERZYKA ŻÓŁCIOWEGO > 65 R.Ż. *,1a,2023,2023
,,55680,55699,1.0,0.82,21.39,2,2,,,,,G25F WYCIĘCIE PĘCHERZYKA ŻÓŁCIOWEGO < 66 R.Ż *,1a,2023,2023
,,7546,8131,1.08,0.12,3.12,5,1,,,,,G26E CHOROBY DRÓG ŻÓŁCIOWYCH > 65 R.Ż.,1a,2023,2023
,,5858,6236,1.06,0.09,2.39,3,1,,,,,G26F CHOROBY DRÓG ŻÓŁCIOWYCH < 66 R.Ż.,1a,2023,2023
,,4452,5265,1.18,0.08,2.02,4,2,,,,,G28 NOWOTWORY DRÓG ŻÓŁCIOWYCH,1a,2023,2023
,,4,4,1.0,0.0,0.0,17,13,,,,,G30 PRZESZCZEPIENIE TRZUSTKI *,1a,2023,2023
,,582,584,1.0,0.01,0.22,9,8,,,,,G31G RESEKCJE TRZUSTKI BEZ ZABIEGÓW REKONSTRUKCYJNYCH *,1a,2023,2023
,,869,871,1.0,0.01,0.33,14,14,,,,,G31H KOMPLEKSOWE ZABIEGI TRZUSTKI Z REKONSTRUKCJĄ (PANKREATODUODENEKTOMIE) *,1a,2023,2023
,,465,466,1.0,0.01,0.18,13,9,,,,,G31O KOMPLEKSOWE ZABIEGI TRZUSTKI Z REKONSTRUKCJĄ (PANKREATODUODENEKTOMIE) W ROZPOZNANIACH NOWOTWORÓW ZŁOŚLIWYCH* *,1a,2023,2023
,,531,552,1.04,0.01,0.21,6,3,,,,,G32 DUŻE ZABIEGI TRZUSTKI *,1a,2023,2023
,,4789,5443,1.14,0.08,2.09,4,2,,,,,G33 ZABIEGI ENDOSKOPOWE I PRZEZSKÓRNE DRÓG ŻÓŁCIOWYCH I TRZUSTKI Z WPROWADZENIEM PROTEZY SAMOROZPRĘŻALNEJ *,1a,2023,2023
,,22110,28862,1.31,0.43,11.08,3,2,,,,,G34 ZABIEGI ENDOSKOPOWE I PRZEZSKÓRNE DRÓG ŻÓŁCIOWYCH I TRZUSTKI *,1a,2023,2023
,,17842,19481,1.09,0.29,7.48,1,0,,,,,G35 INNE ZABIEGI DRÓG ŻÓŁCIOWYCH I TRZUSTKI *,1a,2023,2023
,,7589,7988,1.05,0.12,3.07,10,7,,,,,G36 OSTRE ZAPALENIE TRZUSTKI O CIĘŻKIM PRZEBIEGU,1a,2023,2023
,,15279,16729,1.09,0.25,6.42,6,5,,,,,G37 OSTRE ZAPALENIE TRZUSTKI,1a,2023,2023
,,8454,10347,1.22,0.15,3.97,4,0,,,,,G38 PRZEWLEKŁE CHOROBY TRZUSTKI,1a,2023,2023
,,1128,1129,1.0,0.02,0.43,7,5,,,,,G42 ZABIEGI ŚLEDZIONY *,1a,2023,2023
,,6896,7041,1.02,0.1,1.02,4,3,,,,,"H01 ENDOPROTEZOPLASTYKA ŁOKCIA, BARKU, NADGARSTKA, STAWU SKOKOWO-GOLENIOWEGO, PIERWOTNA CZĘŚCIOWA KOLANA *",1a,2023,2023
,,62,62,1.0,0.0,0.01,8,5,,,,,H02 ENDOPROTEZOPLASTYKA PIERWOTNA CZĘŚCIOWA STAWU BIODROWEGO *,1a,2023,2023
,,513,518,1.01,0.01,0.08,9,7,,,,,"H09 ZABIEGI OPERACYJNE - REWIZYJNE Z POWODU ASEPTYCZNEGO OBLUZOWANIA LUB Z TOWARZYSZĄCYM ZŁAMANIEM ""OKOŁOPROTEZOWYM"" *",1a,2023,2023
,,1010,1099,1.09,0.02,0.16,15,15,,,,,H10 ZABIEGI OPERACYJNE - REWIZYJNE W PRZYPADKACH INFEKCJI WOKÓŁ PROTEZY *,1a,2023,2023
