branch,hospital-types,number-of-patients,number-of-hospitalizations,ratio-of-rehospitalizations,percentage,percentage-of-sections,duration-of-hospitalization-mediana,duration-of-hospitalization-mode,average-value-of-hospitalization,average-value-of-hospitalization-points,average-value-of-drg,average-value-of-drg-points,name,catalog,year,period
,,649,675,1.04,0.01,0.1,1,1,1403.98,27.45,1389.13,27.01,F44 DIAGNOSTYCZNE  I LECZNICZE ZABIEGI JAMY BRZUSZNEJ *,1a,2015,2015
,,94321,99118,1.05,1.38,14.63,3,2,1634.8,32.15,1479.88,28.56,F46 CHOROBY JAMY BRZUSZNEJ,1a,2015,2015
,,8428,8568,1.02,0.12,1.26,4,3,1645.1,32.3,1613.88,31.11,F47 CHOROBY INFEKCYJNE JELIT,1a,2015,2015
,,177,180,1.02,0.0,0.03,11,7,13164.41,277.08,7955.15,153.0,F51 KOMPLEKSOWE ZABIEGI W CHOROBACH ZAPALNYCH JELIT *,1a,2015,2015
,,921,971,1.05,0.01,0.14,7,2,9355.97,204.59,6708.25,129.28,F52 DUŻE I ENDOSKOPOWE ZABIEGI W CHOROBACH ZAPALNYCH JELIT *,1a,2015,2015
,,27808,35227,1.27,0.49,5.2,6,2,4285.49,122.67,3948.86,76.18,F58 CHOROBY ZAPALNE JELIT,1a,2015,2015
,,187,187,1.0,0.0,0.03,15,8,19453.7,385.04,6583.74,126.62,F61 KOMPLEKSOWE ZABIEGI W KRWAWIENIACH Z PRZEWODU POKARMOWEGO *,1a,2015,2015
,,10687,11133,1.04,0.16,1.64,5,4,4588.69,88.43,3407.11,65.65,F62 DUŻE I ENDOSKOPOWE LECZNICZE ZABIEGI W KRWAWIENIACH Z PRZEWODU POKARMOWEGO *,1a,2015,2015
,,13653,14256,1.04,0.2,2.1,5,5,2160.62,43.91,1385.66,26.74,F66 KRWAWIENIA Z PRZEWODU POKARMOWEGO - LECZENIE ZACHOWAWCZE,1a,2015,2015
,,67485,68887,1.02,0.96,10.17,3,2,2608.72,50.6,2588.96,50.21,F72 OPERACJE PRZEPUKLIN JAMY BRZUSZNEJ Z WSZCZEPEM *,1a,2015,2015
,,26062,26297,1.01,0.37,3.88,2,2,1927.32,37.37,1866.41,36.14,F73 OPERACJE PRZEPUKLIN BRZUSZNYCH *,1a,2015,2015
,,9380,9390,1.0,0.13,1.39,5,4,3884.38,78.67,3640.66,70.11,F82 WYCIĘCIE WYROSTKA ROBACZKOWEGO Z POWIKŁANIAMI *,1a,2015,2015
,,18591,18603,1.0,0.26,2.75,4,3,2456.21,48.18,2437.22,46.94,F83 WYCIĘCIE WYROSTKA ROBACZKOWEGO *,1a,2015,2015
,,1499,1528,1.02,0.02,0.23,4,2,1611.82,31.12,1586.02,30.61,F86 CHOROBY WYROSTKA ROBACZKOWEGO,1a,2015,2015
,,17781,18767,1.06,0.26,2.77,3,2,1267.46,24.64,1259.3,24.48,F93 ŚREDNIE ZABIEGI ODBYTU *,1a,2015,2015
,,4129,4405,1.07,0.06,0.65,1,2,442.74,8.55,436.58,8.43,F94 MAŁE ZABIEGI ODBYTU I ODBYTNICY *,1a,2015,2015
,,2562,2682,1.05,0.04,0.4,5,2,2151.58,55.14,2026.01,39.08,F96 CHOROBY ODBYTU,1a,2015,2015
,,735,740,1.01,0.01,0.27,9,7,16409.29,316.34,14665.88,282.74,G01 ROZLEGŁE ZABIEGI WĄTROBY *,1a,2015,2015
,,1834,2345,1.28,0.03,0.86,4,3,9508.66,183.96,8454.05,163.04,G11 KOMPLEKSOWE ZABIEGI WĄTROBY *,1a,2015,2015
,,131,165,1.26,0.0,0.06,5,2,4418.29,85.03,2854.86,54.96,G12 DUŻE ZABIEGI WĄTROBY *,1a,2015,2015
,,241,247,1.02,0.0,0.09,7,2,2513.03,48.38,1141.15,22.0,G13 ŚREDNIE ZABIEGI WĄTROBY *,1a,2015,2015
,,1010,1059,1.05,0.01,0.39,1,1,468.45,9.05,466.04,9.0,G14 MAŁE ZABIEGI WĄTROBY *,1a,2015,2015
,,6794,7381,1.09,0.1,2.7,5,2,3306.26,64.1,2935.41,56.6,G16 OSTRE CHOROBY WĄTROBY,1a,2015,2015
,,23289,27324,1.17,0.38,9.99,9,6,5507.34,110.44,5152.46,99.57,G17 PRZEWLEKŁE CHOROBY WĄTROBY Z PW >5 DNI,1a,2015,2015
,,38652,44983,1.16,0.63,16.44,3,2,2264.71,86.27,2080.81,40.22,G18A PRZEWLEKŁE CHOROBY WĄTROBY BEZ PW  > 17 R. Ż.,1a,2015,2015
,,2281,2722,1.19,0.04,0.99,2,2,2062.63,59.0,2011.23,38.82,G18B PRZEWLEKŁE CHOROBY WĄTROBY BEZ PW < 18 R. Ż.,1a,2015,2015
,,1062,1070,1.01,0.01,0.39,15,9,16921.3,326.34,14214.28,274.13,G21 KOMPLEKSOWE ZABIEGI PRZEWODÓW ŻÓŁCIOWYCH *,1a,2015,2015
,,696,711,1.02,0.01,0.26,12,7,6279.33,120.94,4902.33,94.46,G22 DUŻE ZABIEGI PRZEWODÓW ŻÓŁCIOWYCH *,1a,2015,2015
,,12098,12113,1.0,0.17,4.43,4,3,4282.48,83.59,3668.89,70.83,G24 WYCIĘCIE PĘCHERZYKA ŻÓŁCIOWEGO Z PW *,1a,2015,2015
,,75320,75441,1.0,1.05,27.57,3,3,3333.33,64.62,3233.18,62.56,G25 WYCIĘCIE PĘCHERZYKA ŻÓŁCIOWEGO *,1a,2015,2015
,,16314,17567,1.08,0.24,6.42,4,2,1606.74,31.41,1413.92,27.29,G26 CHOROBY DRÓG ŻÓŁCIOWYCH,1a,2015,2015
,,4129,4788,1.16,0.07,1.75,5,2,3482.93,69.04,3320.19,64.14,G28 NOWOTWORY DRÓG ŻÓŁCIOWYCH,1a,2015,2015
,,12,12,1.0,0.0,0.0,14,14,80066.39,1539.74,79248.0,1524.0,G30 PRZESZCZEPIENIE TRZUSTKI *,1a,2015,2015
,,1517,1522,1.0,0.02,0.56,15,9,25586.64,501.27,15970.36,308.25,G31 KOMPLEKSOWE ZABIEGI TRZUSTKI,1a,2015,2015
,,622,629,1.01,0.01,0.23,10,8,9846.93,189.78,5960.17,115.03,G32 DUŻE ZABIEGI TRZUSTKI *,1a,2015,2015
,,1973,2097,1.06,0.03,0.77,4,2,8340.43,161.03,8203.5,158.38,G33 ZABIEGI ENDOSKOPOWE I PRZEZSKÓRNE DRÓG ŻÓŁCIOWYCH I TRZUSTKI Z WPROWADZENIEM PROTEZY SAMOROZPRĘŻALNEJ *,1a,2015,2015
,,19245,23910,1.24,0.33,8.74,4,2,4482.78,86.86,4222.64,81.63,G34 ZABIEGI ENDOSKOPOWE I PRZEZSKÓRNE DRÓG ŻÓŁCIOWYCH I TRZUSTKI *,1a,2015,2015
,,6474,6978,1.08,0.1,2.55,1,0,2405.21,46.51,2403.66,46.48,G35 INNE ZABIEGI DRÓG ŻÓŁCIOWYCH I TRZUSTKI *,1a,2015,2015
,,4529,4698,1.04,0.07,1.7,13,8,20098.9,387.28,15297.93,294.9,G36 OSTRE ZAPALENIE TRZUSTKI O CIĘŻKIM PRZEBIEGU,1a,2015,2015
,,18945,20907,1.1,0.29,7.64,6,5,4088.47,79.15,2970.75,57.24,G37 OSTRE ZAPALENIE TRZUSTKI,1a,2015,2015
,,10484,12663,1.21,0.18,4.63,5,2,2918.08,62.1,2714.15,52.37,G38 PRZEWLEKŁE CHOROBY TRZUSTKI,1a,2015,2015
,,1531,1539,1.01,0.02,0.56,8,7,12653.37,249.53,5839.94,112.56,G42 ZABIEGI ŚLEDZIONY *,1a,2015,2015
,,1564,1579,1.01,0.02,0.25,6,7,9337.65,181.92,4769.21,92.16,"H01 ENDOPROTEZOPLASTYKA ŁOKCIA, BARKU, NADGARSTKA, STAWU SKOKOWO-GOLENIOWEGO, PIERWOTNA CZĘŚCIOWA KOLANA *",1a,2015,2015
,,1162,1165,1.0,0.02,0.19,11,8,5713.15,114.31,5393.64,103.85,H02 ENDOPROTEZOPLASTYKA PIERWOTNA CZĘŚCIOWA STAWU BIODROWEGO *,1a,2015,2015
,,6948,7027,1.01,0.1,1.12,10,9,9177.9,202.69,8632.61,166.49,"H04 ENDOPROTEZOPLASTYKA PIERWOTNA CAŁKOWITA CEMENTOWA, BIPOLARNA BIODRA *",1a,2015,2015
,,25277,25646,1.01,0.36,4.08,8,8,12337.35,251.44,12126.66,234.14,"H05 ENDOPROTEZOPLASTYKA PIERWOTNA CAŁKOWITA KOLANA, BEZCEMENTOWA BIODRA *",1a,2015,2015
,,24870,25351,1.02,0.35,4.04,8,8,19957.57,403.18,19732.64,381.02,"H06 ENDOPROTEZOPLASTYKA PIERWOTNA CAŁKOWITA BIODRA LUB KOLANA Z REKONSTRUKCJĄ KOSTNĄ, ENDOPROTEZOPLASTYKA STAWU BIODROWEGO Z ZASTOSOWANIEM TRZPIENIA PRZYNASADOWEGO, KAPOPLASTYKA STAWU BIODROWEGO *",1a,2015,2015
,,1670,1709,1.02,0.02,0.27,10,8,13879.29,281.65,13470.7,259.33,H07 ENDOPROTEZOPLASTYKA REWIZYJNA CZĘŚCIOWA *,1a,2015,2015
,,2497,2539,1.02,0.04,0.4,11,8,26310.91,526.97,25600.12,493.44,H08 ENDOPROTEZOPLASTYKA REWIZYJNA CAŁKOWITA *,1a,2015,2015
,,267,271,1.02,0.0,0.04,13,11,9747.29,194.76,9129.73,175.75,"H09 ZABIEGI OPERACYJNE - REWIZYJNE Z POWODU ASEPTYCZNEGO OBLUZOWANIA LUB Z TOWARZYSZĄCYM ZŁAMANIEM ""OKOŁOPROTEZOWYM"" *",1a,2015,2015
,,779,843,1.08,0.01,0.13,18,16,17130.68,347.46,16100.35,310.52,H10 ZABIEGI OPERACYJNE - REWIZYJNE W PRZYPADKACH INFEKCJI WOKÓŁ PROTEZY *,1a,2015,2015
,,333,342,1.03,0.0,0.05,12,11,40008.61,802.52,13032.27,251.19,H11 ZABIEGI RESEKCYJNE ZMIAN NOWOTWOROWYCH LUB GUZOWATYCH Z ENDOPROTEZOPLASTYKĄ LUB ZABIEG REWIZYJNY Z UŻYCIEM PROTEZ PORESEKCYJNYCH *,1a,2015,2015
,,177,187,1.06,0.0,0.03,18,11,13477.21,259.2,12861.91,247.37,H12 CZASOWE IMPLANTY UWALNIAJĄCE ANTYBIOTYKI W LECZENIU INFEKCJI OKOŁOPROTEZOWYCH *,1a,2015,2015
,,17945,18265,1.02,0.25,2.91,2,2,4332.95,83.91,4332.83,83.91,H21 ARTROSKOPOWA REKONSTRUKCJA Z UŻYCIEM IMPLANTÓW MOCUJĄCYCH *,1a,2015,2015
,,55259,56213,1.02,0.78,8.95,2,2,2749.6,53.48,2749.32,53.43,H22 ARTROSKOPIA LECZNICZA *,1a,2015,2015
,,1650,1659,1.01,0.02,0.26,2,2,1540.27,31.58,1475.35,28.45,H23 ARTROSKOPIA DIAGNOSTYCZNO - LECZNICZA *,1a,2015,2015
,,7826,8026,1.03,0.11,1.28,4,2,13116.84,254.16,12943.12,249.4,H31 KOMPLEKSOWE ZABIEGI W ZAKRESIE KOŃCZYNY DOLNEJ I MIEDNICY *,1a,2015,2015
,,22971,23969,1.04,0.33,3.82,3,2,4744.79,93.86,4661.75,90.21,H32 DUŻE ZABIEGI W ZAKRESIE KOŃCZYNY DOLNEJ I MIEDNICY *,1a,2015,2015
,,26512,28943,1.09,0.4,4.61,2,2,1247.88,24.44,1246.49,24.09,H33 ŚREDNIE ZABIEGI NA KOŃCZYNIE DOLNEJ *,1a,2015,2015
,,1502,1560,1.04,0.02,0.25,3,2,11029.0,225.53,10875.08,209.66,"H41 REKONSTRUKCJA FUNKCJI RĘKI, W TYM MIKROCHIRURGICZNA *",1a,2015,2015
,,15565,16208,1.04,0.23,2.58,2,2,4184.07,81.43,4160.0,80.35,H42 DUŻE ZABIEGI NA KOŃCZYNIE GÓRNEJ *,1a,2015,2015
,,28824,30278,1.05,0.42,4.82,1,0,1232.01,24.17,1231.53,23.85,H43 ŚREDNIE ZABIEGI NA KOŃCZYNIE GÓRNEJ *,1a,2015,2015
,,4288,4433,1.03,0.06,0.71,9,8,29273.29,621.79,26978.46,519.43,H51 KOMPLEKSOWE ZABIEGI KOREKCYJNE KRĘGOSŁUPA *,1a,2015,2015
,,13994,14265,1.02,0.2,2.27,5,3,14575.07,309.1,14048.01,271.16,H52 ZABIEGI NA KRĘGOSŁUPIE Z ZASTOSOWANIEM IMPLANTÓW *,1a,2015,2015
,,2909,3114,1.07,0.04,0.5,3,2,9575.6,202.31,9376.93,180.94,H53 ZABIEGI NA KRĘGOSŁUPIE BEZ STOSOWANIA IMPLANTÓW *,1a,2015,2015
,,3507,3885,1.11,0.05,0.62,0,0,3217.32,66.62,3210.81,62.28,H55 ZABIEGI ARTROSKOPOWE I PRZEZSKÓRNE W ZAKRESIE KRĘGOSŁUPA *,1a,2015,2015
,,3109,3208,1.03,0.04,0.51,2,2,658.17,15.26,622.37,12.0,H56C ZESPOŁY BÓLOWE KRĘGOSLUPA < 4 DNI,1a,2015,2015
,,6423,6516,1.01,0.09,1.04,7,4,1568.51,35.88,1555.11,30.0,H56D ZESPOŁY BÓLOWE KRĘGOSŁUPA >3 DNI,1a,2015,2015
,,110,110,1.0,0.0,0.02,21,13,37273.0,717.41,26886.64,517.63,H60 REKONSTRUKCJA ZŁAMAŃ W OBRĘBIE MIEDNICY Z PW *,1a,2015,2015
,,440,445,1.01,0.01,0.07,15,15,21695.74,417.28,16237.04,312.3,H61 REKONSTRUKCJA ZŁAMAŃ W OBRĘBIE MIEDNICY BEZ PW *,1a,2015,2015
,,48107,48799,1.01,0.68,7.77,7,4,5058.21,100.7,4657.34,89.73,H62 ZŁAMANIA LUB ZWICHNIĘCIA W OBRĘBIE MIEDNICY LUB KOŃCZYNY DOLNEJ *,1a,2015,2015
,,41712,42230,1.01,0.59,6.72,3,2,3691.59,71.33,3602.92,69.46,H63 ZŁAMANIA LUB ZWICHNIĘCIA W OBRĘBIE KOŃCZYNY GÓRNEJ *,1a,2015,2015
,,22342,23195,1.04,0.32,3.69,1,1,791.24,15.99,767.78,14.78,H64 MNIEJSZE ZŁAMANIA LUB ZWICHNIĘCIA *,1a,2015,2015
,,1679,1690,1.01,0.02,0.27,17,11,5645.58,117.26,5031.23,96.95,"H66 CZYNNOŚCIOWE LECZENIE ZŁAMAŃ KOŚCI DŁUGICH, STAWOWYCH, MIEDNICY, KRĘGOSŁUPA > 10 DNI",1a,2015,2015
,,1516,1526,1.01,0.02,0.24,5,2,2910.19,58.52,2330.49,44.89,"H67 CZYNNOŚCIOWE LECZENIE ZŁAMAŃ KOŚCI DŁUGICH, STAWOWYCH, MIEDNICY, KRĘGOSŁUPA",1a,2015,2015
,,8751,9342,1.07,0.13,1.49,10,7,7524.33,147.42,6248.65,120.43,H72 AMPUTACJE ROZLEGŁE I DUŻE *,1a,2015,2015
,,2722,2817,1.03,0.04,0.45,3,1,1437.77,27.77,1264.78,24.44,H74 MNIEJSZE AMPUTACJE *,1a,2015,2015
,,2132,2316,1.09,0.03,0.36,16,11,10822.55,209.43,10437.98,201.02,"H81 KOMPLEKSOWE ZABIEGI W CHOROBACH INFEKCYJNYCH, NOWOTWOROWYCH KOŚCI, STAWÓW, TKANKI ŁĄCZNEJ > 10 DNI *",1a,2015,2015
,,2824,2886,1.02,0.04,0.46,3,2,3716.14,71.69,3505.88,67.65,"H82 DUŻE ZABIEGI W CHOROBACH INFEKCYJNYCH, NOWOTWOROWYCH  KOŚCI, STAWÓW, TKANKI ŁĄCZNEJ *",1a,2015,2015
,,62762,65748,1.05,0.92,10.47,2,0,1892.52,37.03,1854.73,36.07,H83 ŚREDNIE ZABIEGI NA TKANKACH MIĘKKICH *,1a,2015,2015
,,9069,9307,1.03,0.13,1.48,0,0,532.66,10.36,514.41,10.0,H84 MNIEJSZE ZABIEGI W OBRĘBIE UKŁADU MIĘŚNIOWO-SZKIELETOWEGO LUB TKANEK MIĘKKICH *,1a,2015,2015
,,1832,1840,1.0,0.03,0.29,3,2,789.28,15.23,637.28,12.29,H85 POURAZOWE USZKODZENIA POZA USZKODZENIEM MÓZGU > 17 R.Ż.,1a,2015,2015
,,7153,7543,1.05,0.11,1.2,2,2,1212.55,25.67,1144.85,22.08,H86 CHOROBY TKANEK MIĘKKICH,1a,2015,2015
,,5856,6930,1.18,0.1,1.1,1,0,1399.86,139.18,1246.12,24.0,H87C CHOROBY ZAPALNE STAWÓW  I TKANKI ŁĄCZNEJ < 4 DNI,1a,2015,2015
,,45447,50019,1.1,0.7,7.96,8,4,3591.17,91.56,3538.5,68.24,H87D CHOROBY ZAPALNE STAWÓW I TKANKI ŁĄCZNEJ > 3 DNI,1a,2015,2015
,,3045,3359,1.1,0.05,0.53,8,7,3529.62,68.56,3448.63,66.52,H88 CHOROBY INFEKCYJNE KOŚCI I STAWÓW,1a,2015,2015
,,11949,15333,1.28,0.21,2.44,1,0,637.33,15.06,623.23,12.0,H89C CHOROBY NIEZAPALNE KOŚCI I STAWÓW < 4 DNI,1a,2015,2015
,,21723,23116,1.06,0.32,3.68,7,4,2223.78,48.15,2184.58,42.12,H89D CHOROBY NIEZAPALNE KOŚCI I STAWÓW > 3 DNI,1a,2015,2015
,,29,31,1.07,0.0,0.0,13,11,14323.01,275.44,7437.68,143.03,H90 ZAPALENIA STAWÓW I UKŁADOWE CHOROBY TKANKI ŁĄCZNEJ WYMAGAJĄCE INTENSYWNEGO LECZENIA > 10 DNI,1a,2015,2015
,,1850,2037,1.1,0.03,0.32,4,2,9074.86,179.51,9024.17,173.76,H92 ZABIEGI REKONSTRUKCYJNE DEFORMACJI UKŁADU KOSTNO-STAWOWEGO < 18 R.Ż.,1a,2015,2015
,,9477,14151,1.49,0.2,2.25,3,0,1782.14,41.78,1556.98,30.0,H96C UKŁADOWE CHOROBY TKANKI ŁĄCZNEJ,1a,2015,2015
,,4591,5035,1.1,0.07,0.8,8,4,4765.15,95.18,4487.34,86.35,H96D UKŁADOWE CHOROBY TKANKI ŁĄCZNEJ > 3 DNI,1a,2015,2015
,,1008,1037,1.03,0.01,0.17,7,7,1878.63,36.25,1869.86,36.08,H98 KRYSTALOPATIE,1a,2015,2015
,,630,648,1.03,0.01,0.31,6,4,8896.11,172.49,8776.91,170.19,J01 RADYKALNE ODJĘCIE PIERSI Z REKONSTRUKCJĄ *,1a,2015,2015
,,15268,15663,1.03,0.22,7.41,4,2,5362.92,104.1,5272.95,101.85,J02 KOMPLEKSOWE ZABIEGI W OBRĘBIE PIERSI *,1a,2015,2015
,,6553,6747,1.03,0.09,3.19,3,2,3386.91,65.75,3363.84,64.87,J03 DUŻE ZABIEGI W OBRĘBIE PIERSI *,1a,2015,2015
,,1333,1605,1.2,0.02,0.76,4,3,4826.68,93.45,4821.34,93.34,J04 ZABIEGI REKONSTRUKCYJNE PIERSI *,1a,2015,2015
,,6660,6786,1.02,0.09,3.21,2,0,1182.38,23.02,1180.98,23.0,J05 ŚREDNIA CHIRURGIA PIERSI *,1a,2015,2015
,,3758,3801,1.01,0.05,1.8,1,0,551.43,10.69,540.75,10.48,J06 MAŁA CHIRURGIA PIERSI *,1a,2015,2015
,,1189,1222,1.03,0.02,0.58,1,0,683.67,13.18,615.96,11.88,J07 CHOROBY PIERSI ŁAGODNE *,1a,2015,2015
,,5361,6538,1.22,0.09,3.09,2,2,1744.85,66.96,1546.99,29.88,J08 CHOROBY PIERSI ZŁOŚLIWE *,1a,2015,2015
,,5484,5812,1.06,0.08,2.75,0,0,2059.38,40.0,2059.27,40.0,J10 BIOPSJA MAMMOTOMICZNA *,1a,2015,2015
,,69,69,1.0,0.0,0.03,14,1,129944.75,2498.94,63246.32,1216.28,J22 EKSTREMALNE OPARZENIA Z ZABIEGIEM CHIRURGICZNYM > 15 DNI *,1a,2015,2015
,,864,867,1.0,0.01,0.41,21,11,56410.97,1287.63,45422.05,879.12,J23 CIĘŻKIE OPARZENIA Z ZABIEGIEM CHIRURGICZNYM > 10 DNI *,1a,2015,2015
,,1321,1338,1.01,0.02,0.63,12,6,34694.08,701.61,33760.71,651.2,J24 ŚREDNIE OPARZENIA/ODMROŻENIA Z ZABIEGIEM CHIRURGICZNYM > 5 DNI *,1a,2015,2015
,,8,8,1.0,0.0,0.0,7,0,41242.89,793.13,21606.0,415.5,J25 EKSTREMALNE OPARZENIA > 15 DNI,1a,2015,2015
,,229,230,1.0,0.0,0.11,13,11,23525.8,500.71,14358.16,277.69,J26 CIĘŻKIE OPARZENIA > 10 DNI,1a,2015,2015
,,1491,1504,1.01,0.02,0.71,8,6,5057.34,102.03,4686.23,90.22,J27 ŚREDNIE OPARZENIA/ODMROŻENIA > 5 DNI,1a,2015,2015
,,4137,4170,1.01,0.06,1.97,4,2,2318.87,44.97,2216.44,42.67,J28 LEKKIE OPARZENIA/ODMROŻENIA,1a,2015,2015
,,53,54,1.02,0.0,0.03,1,1,3713.41,72.51,1196.0,23.0,J29 OPARZENIA/ODMROŻENIA PRZED PRZENIESIENIEM DO ODDZIAŁU SPECJALISTYCZNEGO,1a,2015,2015
,,13144,14075,1.07,0.2,6.65,2,0,3247.68,65.09,3199.48,62.12,J32 DUŻE ZABIEGI SKÓRNE *,1a,2015,2015
,,36957,38982,1.05,0.54,18.43,0,0,963.09,18.83,958.66,18.59,J33 ŚREDNIE ZABIEGI SKÓRNE *,1a,2015,2015
,,8040,8828,1.1,0.12,4.17,10,7,7083.66,142.01,6579.41,126.92,J34 LECZENIE CHIRURGICZNE ZMIAN TROFICZNYCH STOPY *,1a,2015,2015
,,874,1401,1.6,0.02,0.66,0,0,1318.9,25.56,1220.91,23.68,J35 LECZENIE ANOMALII NACZYNIOWYCH LASEREM PULSACYJNO-BARWNIKOWYM<18 R.Ż.,1a,2015,2015
,,13993,16483,1.18,0.23,7.79,9,7,3865.79,78.71,3387.54,65.5,J37 OWRZODZENIA SKÓRY,1a,2015,2015
,,6274,7244,1.15,0.1,3.42,5,2,4208.5,81.17,4115.11,79.28,J38 CIĘŻKIE CHOROBY DERMATOLOGICZNE,1a,2015,2015
,,26774,30326,1.13,0.42,14.34,6,3,1705.48,35.29,1653.87,31.88,J39 DUŻE CHOROBY DERMATOLOGICZNE,1a,2015,2015
,,11088,11376,1.03,0.16,5.38,6,4,2270.04,43.76,2062.26,39.8,J46 DUŻE CHOROBY INFEKCYJNE SKÓRY,1a,2015,2015
,,2100,2556,1.22,0.04,1.21,0,0,1899.49,71.86,1807.98,34.9,J47 DUŻE GUZY SKÓRY,1a,2015,2015
,,21822,23182,1.06,0.32,10.96,2,2,1085.36,20.93,1047.62,20.2,J49 ŁAGODNE CHOROBY DERMATOLOGICZNE,1a,2015,2015
,,2522,2546,1.01,0.04,1.19,4,3,14917.6,288.07,14786.49,285.55,K01 ZABIEGI RADYKALNE W RAKACH GRUCZOŁÓW DOKREWNYCH *,1a,2015,2015
,,1626,1626,1.0,0.02,0.76,3,3,6622.28,131.83,6495.7,129.39,K02 OPERACJA WOLA GUZOWATEGO POWIKŁANEGO *,1a,2015,2015
,,21461,21574,1.01,0.3,10.09,4,3,3932.92,76.45,3842.26,74.28,K03 ZABIEGI DOTYCZĄCE TARCZYCY I PRZYTARCZYC *,1a,2015,2015
,,1094,1102,1.01,0.02,0.52,6,7,7984.74,156.0,6965.73,134.46,K04 ZABIEGI DOTYCZĄCE NADNERCZY *,1a,2015,2015
,,566,596,1.05,0.01,0.28,0,0,631.57,12.22,629.22,12.17,"K05 ZABIEGI DIAGNOSTYCZNE TARCZYCY, PRZYTARCZYC, NADNERCZY *",1a,2015,2015
,,78,79,1.01,0.0,0.04,7,6,4742.52,91.2,4382.48,84.28,K06 STANY NAGLĄCE W ENDOKRYNOLOGII,1a,2015,2015
,,8074,8667,1.07,0.12,4.05,2,2,1993.6,38.92,1989.72,38.76,K16 CHOROBY  PRZYSADKI,1a,2015,2015
,,13104,13771,1.05,0.19,6.44,5,4,1549.99,30.3,1466.0,28.33,K26 ZABURZENIA WODNO-ELEKTROLITOWE,1a,2015,2015
,,28154,29595,1.05,0.41,13.84,5,2,2832.8,55.68,2556.63,49.55,K27A ZABURZENIA ODŻYWIENIA > 17 R.Ż.,1a,2015,2015
,,8502,9206,1.08,0.13,4.31,2,2,2506.74,50.3,2407.22,46.39,K27B ZABURZENIA ODŻYWIENIA < 18 R. Ż.,1a,2015,2015
,,18450,21501,1.17,0.3,10.06,3,2,3724.59,74.23,3679.94,71.27,K28 WRODZONE WADY METABOLICZNE,1a,2015,2015
,,21629,22608,1.05,0.32,10.58,6,7,2377.91,46.4,2270.93,43.85,K35 CUKRZYCA Z POWIKŁANIAMI I INNE STANY HIPOGLIKEMICZNE,1a,2015,2015
,,4975,5500,1.11,0.08,2.57,6,7,2763.4,53.79,2494.54,48.15,K37 CUKRZYCA ZE STANAMI HIPERGLIKEMICZNYMI,1a,2015,2015
,,3521,3987,1.13,0.06,1.87,9,7,4601.47,88.86,4396.75,84.87,K39 STOPA CUKRZYCOWA,1a,2015,2015
,,291,315,1.08,0.0,0.15,7,7,2717.57,53.65,2679.73,52.9,K46 CIĘŻKIE CHOROBY TARCZYCY,1a,2015,2015
,,10842,11750,1.08,0.16,5.5,3,0,1477.94,29.68,1438.69,27.87,K47 CHOROBY TARCZYCY,1a,2015,2015
,,537,1438,2.68,0.02,0.67,2,3,3030.61,59.39,3030.61,59.39,K48 ORBITOPATIA TARCZYCOWA - TERAPIA PRZECIWZAPALNA I PRZYGOTOWANIE DO RADIOTERAPII I LECZENIA DEKOMPRESYJNEGO,1a,2015,2015
,,16054,18547,1.16,0.26,8.68,3,2,3397.22,66.28,3393.38,66.19,"K53 NADCZYNNOŚĆ GRUCZOŁÓW DOKREWNYCH POZA HIPERPROLAKTYNEMIĄ, NADCZYNNOŚCIĄ TARCZYCY I GUZAMI NEUROENDOKRYNNYMI PRZEWODU POKARMOWEGO I UKŁADU ODDECHOWEGO",1a,2015,2015
,,235,241,1.03,0.0,0.11,5,4,2252.86,44.14,2252.86,44.14,K54 AUTOIMMUNOLOGICZNE ZESPOŁY WIELOGRUCZOŁOWE,1a,2015,2015
,,371,409,1.1,0.01,0.19,3,2,4556.7,162.27,4460.56,85.78,K57 GUZY NEUROENDOKRYNNE,1a,2015,2015
,,5174,5734,1.11,0.08,2.68,3,3,2736.25,62.27,2552.15,49.58,K58 NOWOTWORY ENDOKRYNNE POZA PRZYSADKĄ,1a,2015,2015
,,26953,28341,1.05,0.4,13.26,5,3,1948.94,38.3,1894.12,36.63,K59 INNE CHOROBY UKŁADU WYDZIELANIA WEWNĘTRZNEGO,1a,2015,2015
,,1244,1356,1.09,0.02,0.63,2,2,3658.19,77.13,3348.69,64.64,K60 NOWOTWORY GRUCZOŁÓW DOKREWNYCH,1a,2015,2015
,,3044,3277,1.08,0.05,1.53,4,4,10504.87,204.55,9971.64,194.0,K63 KWALIFIKACJA DO LECZENIA JODEM RADIOAKTYWNYM RAKA TARCZYCY LUB OCENA SKUTECZNOŚCI LECZENIA Z ZASTOSOWANIEM REKOMBINOWANEGO TSH [RHTSH],1a,2015,2015
,,9213,9322,1.01,0.13,2.06,8,8,8063.95,155.38,7249.05,139.67,L00 NEFREKTOMIA I INNE DUŻE OTWARTE ZABIEGI NEREK *,1a,2015,2015
,,602,610,1.01,0.01,0.13,9,7,4622.03,89.03,3448.21,66.41,L03 ŚREDNIE OTWARTE ZABIEGI NEREK *,1a,2015,2015
,,4508,4750,1.05,0.07,1.05,6,4,5259.86,101.4,5184.6,99.95,L05 DUŻE ENDOSKOPOWE ZABIEGI NEREK *,1a,2015,2015
,,2958,3303,1.12,0.05,0.73,3,2,2313.49,45.5,2075.84,40.04,L06 ŚREDNIE ENDOSKOPOWE ZABIEGI NEREK *,1a,2015,2015
,,17926,18800,1.05,0.26,4.15,6,6,1397.1,30.08,1251.29,24.15,L07 ZAKAŻENIA NEREK LUB DRÓG MOCZOWYCH,1a,2015,2015
,,7214,8963,1.24,0.12,1.98,2,0,3005.63,100.58,2685.33,51.74,L08 NOWOTWORY NEREK I DRÓG MOCZOWYCH,1a,2015,2015
,,1779,3083,1.73,0.04,0.68,0,0,1212.95,23.49,1205.45,23.34,L09 MAŁE ZABIEGI NEREK *,1a,2015,2015
,,16928,20582,1.22,0.29,4.55,0,0,324.51,6.26,319.26,6.16,L104 INNE PROCEDURY W ZAKRESIE UKŁADU MOCZOWO - PŁCIOWEGO *,1a,2015,2015
,,497,501,1.01,0.01,0.11,9,8,5717.5,110.17,5490.85,105.85,L12 DUŻE OTWARTE ZABIEGI MOCZOWODU *,1a,2015,2015
,,531,544,1.02,0.01,0.12,9,9,3568.53,68.7,3202.36,61.66,L13 ŚREDNIE OTWARTE ZABIEGI MOCZOWODU *,1a,2015,2015
,,15472,17375,1.12,0.24,3.84,3,2,4128.9,79.82,4111.41,79.47,L15 DUŻE ENDOSKOPOWE ZABIEGI MOCZOWODU *,1a,2015,2015
,,1467,1524,1.04,0.02,0.34,2,0,1983.31,43.91,1957.34,38.12,L16 ŚREDNIE ENDOSKOPOWE ZABIEGI MOCZOWODU *,1a,2015,2015
,,10156,12389,1.22,0.17,2.74,2,0,1324.19,25.64,1258.37,24.3,L17 MAŁE ENDOSKOPOWE ZABIEGI MOCZOWODU *,1a,2015,2015
,,987,988,1.0,0.01,0.22,14,11,21361.91,411.35,17499.54,337.05,L21 KOMPLEKSOWE ZABIEGI PĘCHERZA MOCZOWEGO Z WYTWORZENIEM PRZETOKI *,1a,2015,2015
,,824,824,1.0,0.01,0.18,14,9,18358.68,353.49,16054.13,309.13,"L22 DUŻE OTWARTE ZABIEGI NA PĘCHERZU MOCZOWYM, W TYM PLASTYKA *",1a,2015,2015
,,603,607,1.01,0.01,0.13,7,8,2843.91,55.01,1863.18,35.96,L23 ŚREDNIE OTWARTE ZABIEGI NA PĘCHERZU MOCZOWYM *,1a,2015,2015
,,204,218,1.07,0.0,0.05,9,3,5909.58,113.84,4512.85,86.98,L24 ZABIEGI W ZAKRESIE PRZETOK ODPROWADZAJĄCYCH MOCZ *,1a,2015,2015
,,77,90,1.17,0.0,0.02,3,3,4407.28,84.81,4383.76,84.36,L25 DUŻE ENDOSKOPOWE ZABIEGI NA PĘCHERZU MOCZOWYM *,1a,2015,2015
,,27130,35434,1.31,0.49,7.83,3,2,2733.4,54.56,2667.1,51.48,L26 ŚREDNIE ZABIEGI ENDOSKOPOWE NA PĘCHERZU MOCZOWYM *,1a,2015,2015
,,3852,4153,1.08,0.06,0.92,0,0,457.67,8.82,406.27,7.83,L27 ZABURZENIA ODPŁYWU MOCZU,1a,2015,2015
,,4544,5509,1.21,0.08,1.22,1,0,780.27,15.03,738.49,14.23,L29 CHOROBY PĘCHERZA MOCZOWEGO I MOCZOWODU,1a,2015,2015
,,6821,7727,1.13,0.11,1.71,0,0,966.88,18.79,957.44,18.56,L30 MAŁE ZABIEGI PĘCHERZA MOCZOWEGO *,1a,2015,2015
,,4683,4684,1.0,0.07,1.02,7,6,8535.78,164.5,8297.26,159.91,L31 RADYKALNA PROSTATEKTOMIA *,1a,2015,2015
,,1635,1636,1.0,0.02,0.36,10,8,5659.45,108.54,5311.11,102.18,L32 OTWARTE ZABIEGI GRUCZOŁU KROKOWEGO I SZYI PĘCHERZA MOCZOWEGO *,1a,2015,2015
,,14050,14489,1.03,0.2,3.16,4,3,3631.81,70.3,3595.94,69.37,L43 PRZEZCEWKOWA RESEKCJA GRUCZOŁU KROKOWEGO *,1a,2015,2015
,,913,969,1.06,0.01,0.21,0,0,1447.71,28.0,1435.16,27.76,L45 ENDOSKOPOWE ZABIEGI GRUCZOŁU KROKOWEGO LUB PĘCHERZA MOCZOWEGO *,1a,2015,2015
,,4968,5691,1.15,0.08,1.26,2,1,624.23,13.5,539.76,10.41,L46 CHOROBY GRUCZOŁU KROKOWEGO,1a,2015,2015
,,20265,20962,1.03,0.29,4.63,0,0,1102.76,21.27,1101.9,21.25,L47 MAŁE ZABIEGI GRUCZOŁU KROKOWEGO LUB PĘCHERZA MOCZOWEGO *,1a,2015,2015
,,1675,1735,1.04,0.02,0.38,5,2,4530.71,87.54,4485.58,86.67,L52 DUŻE OTWARTE ZABIEGI CEWKI MOCZOWEJ *,1a,2015,2015
,,5342,5998,1.12,0.08,1.32,2,2,1781.94,34.53,1769.0,34.28,L53 ŚREDNIE ZABIEGI CEWKI MOCZOWEJ *,1a,2015,2015
,,1082,1213,1.12,0.02,0.27,0,0,629.9,12.21,619.19,12.0,L54 MAŁE ZABIEGI CEWKI MOCZOWEJ *,1a,2015,2015
,,1132,1153,1.02,0.02,0.25,2,0,2747.67,53.31,2633.89,51.12,L62 DUŻE I ŚREDNIE ZABIEGI PRĄCIA *,1a,2015,2015
,,10920,11083,1.01,0.15,2.45,0,0,591.73,11.49,566.18,11.0,L64 MAŁE ZABIEGI  PRĄCIA *,1a,2015,2015
,,4350,4590,1.06,0.06,1.01,3,2,869.25,21.58,824.17,15.89,"L69 CHOROBY PRĄCIA, JĄDER, NASIENIOWODU, MOCZOWODU I CEWKI MOCZOWEJ",1a,2015,2015
,,13534,14005,1.03,0.2,3.09,3,2,1627.68,31.84,1568.0,30.35,"L72A ZABIEGI MOSZNY, JĄDRA, NAJĄDRZA I NASIENIOWODU > 17 R. Ż.",1a,2015,2015
,,13211,13687,1.04,0.19,3.02,2,2,2680.6,51.81,2679.94,51.8,"L72B ZABIEGI MOSZNY, JĄDRA, NAJĄDRZA I NASIENIOWODU < 18 R.Ż.",1a,2015,2015
,,4423,6509,1.47,0.09,1.44,6,2,4409.36,87.17,3344.37,65.13,L81 LECZENIE POWIKŁAŃ LECZENIA NERKOZASTĘPCZEGO > 17 R.Ż,1a,2015,2015
,,29193,30853,1.06,0.43,6.81,8,7,4900.39,97.19,4094.64,79.1,L82 OSTRA NIEWYDOLNOŚĆ NEREK,1a,2015,2015
,,17738,21066,1.19,0.29,4.65,6,2,2168.91,43.09,1806.0,34.88,L83 PRZEWLEKŁA NIEWYDOLNOŚĆ NEREK,1a,2015,2015
,,68301,84572,1.24,1.18,18.68,4,2,2903.49,57.52,2777.24,53.65,L84 INNE CHOROBY NEREK,1a,2015,2015
,,19658,20927,1.06,0.29,4.62,2,2,690.78,13.32,673.9,12.98,L85 KAMICA MOCZOWA,1a,2015,2015
,,3823,4013,1.05,0.06,0.89,2,2,554.68,10.88,468.0,9.02,L86 BADANIA W ZAKRESIE DRÓG MOCZOWYCH,1a,2015,2015
,,44,125,2.84,0.0,0.03,3,2,6853.59,132.16,4096.03,79.01,L87 LECZENIE POWIKŁAŃ LECZENIA NERKOZASTĘPCZEGO < 18 R.Ż,1a,2015,2015
,,85,88,1.04,0.0,0.02,5,3,29276.0,563.0,29276.0,563.0,L91 IMPLANTACJA LUB WYMIANA HYDRAULICZNEGO ZWIERACZA CEWKI MOCZOWEJ (AUS) *,1a,2015,2015
,,14103,24335,1.73,0.34,5.38,0,0,937.6,18.1,936.25,18.08,L92 ESWL *,1a,2015,2015
,,1000,1000,1.0,0.01,0.22,16,13,50977.09,980.79,44564.52,857.01,L94 PRZESZCZEPIENIE NERKI > 17 R. Ż. *,1a,2015,2015
,,37,37,1.0,0.0,0.01,19,16,49908.13,959.77,48510.38,932.89,L96 PRZESZCZEPIENIE NERKI < 18 R.Ż.,1a,2015,2015
,,30,30,1.0,0.0,0.01,20,13,103449.01,1989.4,103272.0,1986.0,L97 PRZESZCZEPIENIE NERKI I TRZUSTKI *,1a,2015,2015
,,278,279,1.0,0.0,0.05,11,7,13695.23,263.75,13554.35,260.88,M01 KOMPLEKSOWE ZABIEGI DOLNEJ CZĘŚCI UKŁADU ROZRODCZEGO BEZ PW *,1a,2015,2015
,,27016,27450,1.02,0.38,5.23,4,4,4220.34,81.49,4203.26,81.15,M02 DUŻE ZABIEGI DOLNEJ CZĘŚCI UKŁADU ROZRODCZEGO *,1a,2015,2015
,,16274,16556,1.02,0.23,3.15,1,0,1252.48,24.24,1249.69,24.17,M03 ŚREDNIE ZABIEGI DOLNEJ CZĘŚCI UKŁADU ROZRODCZEGO *,1a,2015,2015
,,26452,27414,1.04,0.38,5.28,0,0,471.32,9.09,469.95,9.06,M04 MAŁE ZABIEGI DOLNEJ CZĘŚCI UKŁADU ROZRODCZEGO *,1a,2015,2015
,,8662,8807,1.02,0.12,1.7,3,2,3812.56,73.97,3811.89,73.96,M05 ZABIEGI W NIETRZYMANIU MOCZU *,1a,2015,2015
,,66,66,1.0,0.0,0.01,9,8,15295.95,295.55,14965.55,289.18,M06 KOMPLEKSOWE ZABIEGI DOLNEJ CZĘŚCI UKŁADU ROZRODCZEGO Z PW *,1a,2015,2015
,,4641,4646,1.0,0.06,0.89,7,7,14393.8,281.18,14053.88,270.63,M11 KOMPLEKSOWE ZABIEGI GÓRNEJ CZĘŚCI UKŁADU ROZRODCZEGO BEZ PW *,1a,2015,2015
,,2004,2005,1.0,0.03,0.38,8,7,9048.25,182.1,8782.27,169.21,M12 BARDZO DUŻE ZABIEGI GÓRNEJ CZĘŚCI UKŁADU ROZRODCZEGO BEZ PW *,1a,2015,2015
,,50147,50363,1.0,0.7,9.6,5,4,3630.69,70.65,3562.67,68.74,M13 DUŻE ZABIEGI GÓRNEJ CZĘŚCI UKŁADU ROZRODCZEGO *,1a,2015,2015
,,61488,62707,1.02,0.87,11.95,2,0,2346.38,45.6,2328.24,45.09,M14 ŚREDNIE ZABIEGI GÓRNEJ CZĘŚCI UKŁADU ROZRODCZEGO *,1a,2015,2015
,,167448,172912,1.03,2.41,33.29,0,0,735.25,14.2,732.88,14.14,M15 MAŁE ZABIEGI GÓRNEJ CZĘŚCI UKŁADU ROZRODCZEGO *,1a,2015,2015
,,78463,87582,1.12,1.22,16.68,2,2,1320.96,25.46,1317.93,25.4,"M16 ZAGRAŻAJĄCE LUB DOKONANE PORONIENIE, ZAKOŃCZENIE CIĄŻY OBUMARŁEJ *",1a,2015,2015
,,1988,1998,1.0,0.03,0.38,2,1,1352.36,26.17,1345.89,26.0,M17 INDUKCJA PORONIENIA,1a,2015,2015
,,2433,2492,1.02,0.03,0.47,1,0,655.57,12.62,648.71,12.49,M18 LECZENIE ZACHOWAWCZE DOLNEJ CZĘŚCI UKŁADU ROZRODCZEGO,1a,2015,2015
,,3050,3168,1.04,0.04,0.6,2,0,670.53,12.93,668.12,12.88,M19 LECZENIE ZACHOWAWCZE ZABURZEŃ STATYKI NARZĄDU RODNEGO,1a,2015,2015
