branch,hospital-types,number-of-patients,number-of-hospitalizations,ratio-of-rehospitalizations,percentage,percentage-of-sections,duration-of-hospitalization-mediana,duration-of-hospitalization-mode,average-value-of-hospitalization,average-value-of-hospitalization-points,average-value-of-drg,average-value-of-drg-points,name,catalog,year,period
,,5432,5568,1.02,0.08,1.23,9,7,16686.36,376.71,7776.51,150.15,A01 ZABIEGI WEWNĄTRZCZASZKOWE Z POWODU POWAŻNEGO URAZU *,1a,2014,2014
,,538,548,1.02,0.01,0.12,8,8,10171.85,197.57,6916.32,134.3,A02 ZABIEGI WEWNĄTRZCZASZKOWE Z POWODU URAZU *,1a,2014,2014
,,265,331,1.25,0.0,0.07,4,3,48882.77,940.05,48880.0,940.0,A03 WSZCZEPIENIE STYMULATORA STRUKTUR GŁĘBOKICH MÓZGU/STYMULATORA NERWU BŁĘDNEGO *,1a,2014,2014
,,317,344,1.09,0.0,0.08,3,2,32539.71,626.66,32453.4,625.0,A04 WSZCZEPIENIE/WYMIANA STYMULATORA RDZENIA KRĘGOWEGO LUB WYMIANA GENERATORA DO STYMULACJI STRUKTUR GŁĘBOKICH MÓZGU *,1a,2014,2014
,,7341,7534,1.03,0.1,1.66,11,8,18658.02,384.76,15567.03,300.45,A11 KOMPLEKSOWE ZABIEGI WEWNĄTRZCZASZKOWE *,1a,2014,2014
,,5463,5759,1.05,0.08,1.27,10,8,14774.8,341.16,10335.59,199.53,A12 DUŻE ZABIEGI WEWNĄTRZCZASZKOWE *,1a,2014,2014
,,1693,1820,1.08,0.03,0.4,6,2,8294.91,188.16,6180.43,119.52,A13 ŚREDNIE ZABIEGI WEWNĄTRZCZASZKOWE *,1a,2014,2014
,,536,557,1.04,0.01,0.12,1,0,1591.4,30.63,1522.99,29.31,A14 MAŁE ZABIEGI WEWNĄTRZCZASZKOWE *,1a,2014,2014
,,15038,15303,1.02,0.21,3.37,6,4,11598.67,244.61,11466.89,223.25,A22 DUŻE ZABIEGI NA RDZENIU KRĘGOWYM I W KANALE KRĘGOWYM *,1a,2014,2014
,,2687,2714,1.01,0.04,0.6,6,3,6717.07,143.22,6694.96,128.9,A23 ŚREDNIE ZABIEGI NA RDZENIU KRĘGOWYM I W KANALE KRĘGOWYM *,1a,2014,2014
,,27,27,1.0,0.0,0.01,5,5,1587.89,30.67,1587.89,30.67,A24 MAŁE ZABIEGI NA RDZENIU KRĘGOWYM I W KANALE KRĘGOWYM *,1a,2014,2014
,,6948,7468,1.07,0.1,1.64,2,2,4657.37,90.7,4655.52,90.23,A25 ZABIEGI NA NERWACH OBWODOWYCH *,1a,2014,2014
,,1710,1933,1.13,0.03,0.43,0,0,570.77,11.01,570.49,11.0,A26 ZABIEGI ZWALCZAJĄCE BÓL I NA UKŁADZIE WSPÓŁCZULNYM *,1a,2014,2014
,,3167,3232,1.02,0.04,0.71,8,7,9839.72,231.97,5652.31,109.86,A30 KOMPLEKSOWA DIAGNOSTYKA POLINEUROPATII I CHORÓB MIĘŚNI,1a,2014,2014
,,15307,16224,1.06,0.23,3.57,5,2,3279.95,67.9,1496.68,28.98,A31 CHOROBY NERWÓW OBWODOWYCH,1a,2014,2014
,,1906,2235,1.17,0.03,0.49,6,2,7532.78,172.32,3051.37,59.05,A32 CHOROBY MIĘŚNI,1a,2014,2014
,,7511,7545,1.0,0.1,1.66,4,3,1651.45,31.9,1644.73,31.77,A33 ZABURZENIA RÓWNOWAGI,1a,2014,2014
,,4869,5572,1.14,0.08,1.23,2,2,1545.73,43.89,1398.02,27.0,A34C GUZY MÓZGU I RDZENIA KRĘGOWEGO,1a,2014,2014
,,11093,11891,1.07,0.17,2.62,8,4,4543.86,95.89,4448.9,85.91,A34D GUZY MÓZGU I RDZENIA KRĘGOWEGO>3 DNI,1a,2014,2014
,,4150,4507,1.09,0.06,0.99,3,2,1896.59,60.83,1469.22,28.46,A35C CHOROBY ZWYRODNIENIOWE OUN,1a,2014,2014
,,2398,2435,1.02,0.03,0.54,7,4,3261.04,64.51,3230.9,63.47,A35D CHOROBY ZWYRODNIENIOWE OUN>3 DNI,1a,2014,2014
,,11430,15112,1.32,0.21,3.33,4,4,3738.71,123.59,3484.2,67.31,A36 CHOROBY DEMIELINIZACYJNE,1a,2014,2014
,,30543,32334,1.06,0.45,7.12,6,4,3460.95,89.52,3033.0,58.56,A45 CHOROBY NACZYŃ MÓZGOWYCH - LECZENIE ZACHOWAWCZE,1a,2014,2014
,,15053,15339,1.02,0.21,3.38,5,4,1985.15,40.16,1882.98,36.49,A46 PRZEMIJAJĄCE NIEDOKRWIENIE MÓZGU,1a,2014,2014
,,27573,27937,1.01,0.39,6.15,5,4,3861.38,76.17,3853.16,74.43,A47 PRZEMIJAJĄCE NIEDOKRWIENIE MÓZGU - ROZSZERZONA DIAGNOSTYKA,1a,2014,2014
,,45050,46093,1.02,0.64,10.15,10,8,8970.2,319.49,8562.4,164.92,A48 KOMPLEKSOWE LECZENIE UDARÓW MÓZGU > 7 DNI W ODDZIALE UDAROWYM,1a,2014,2014
,,22221,22502,1.01,0.31,4.95,9,8,4539.41,189.74,4100.2,79.26,A49 UDAR MÓZGU - LECZENIE > 3 DNI,1a,2014,2014
,,15381,15661,1.02,0.22,3.45,4,1,3297.5,81.59,1955.61,37.87,A50 UDAR MÓZGU - LECZENIE,1a,2014,2014
,,5632,5656,1.0,0.08,1.25,10,8,13280.79,432.47,12714.1,244.91,A51 UDAR MÓZGU - LECZENIE TROMBOLITYCZNE > 7 DNI W ODDZIALE UDAROWYM,1a,2014,2014
,,3605,3696,1.03,0.05,0.81,6,4,1669.65,32.24,1649.9,31.86,A56 CHOROBY NERWÓW CZASZKOWYCH,1a,2014,2014
,,5326,6423,1.21,0.09,1.41,10,2,5001.9,104.33,3894.31,75.15,A57 CHOROBY ZAPALNE UKŁADU NERWOWEGO,1a,2014,2014
,,1274,1282,1.01,0.02,0.28,5,3,3103.34,84.67,2317.55,44.68,A58 ENCEFALOPATIA,1a,2014,2014
,,29311,29891,1.02,0.42,6.58,3,2,1404.6,27.75,1394.38,26.97,A59 BÓLE GŁOWY,1a,2014,2014
,,10888,11845,1.09,0.16,2.61,3,2,1188.01,24.13,827.54,16.0,A66 PADACZKA - DIAGNOSTYKA I LECZENIE,1a,2014,2014
,,10881,11174,1.03,0.16,2.46,6,4,4248.0,86.57,4113.37,79.39,A67 PADACZKA - DIAGNOSTYKA I LECZENIE > 3 DNI,1a,2014,2014
,,12060,12341,1.02,0.17,2.72,4,2,2540.32,57.61,1667.88,32.21,A76 URAZY GŁOWY Z ISTOTNYM USZKODZENIEM MÓZGU LECZONE ZACHOWAWCZO,1a,2014,2014
,,20739,20880,1.01,0.29,4.6,2,1,846.42,16.34,830.1,16.0,A77 URAZY GŁOWY BEZ ISTOTNEGO USZKODZENIA MÓZGU LECZONE ZACHOWAWCZO,1a,2014,2014
,,1043,1271,1.22,0.02,0.28,6,2,5285.01,131.53,4163.65,80.57,A86 CHOROBY NEURONU RUCHOWEGO,1a,2014,2014
,,56838,59024,1.04,0.82,13.0,5,2,1804.95,45.19,1590.04,30.78,A87A INNE CHOROBY UKŁADU NERWOWEGO>17 R.Ż.,1a,2014,2014
,,11251,12140,1.08,0.17,2.67,2,2,1834.31,36.21,1695.22,32.65,A87B INNE CHOROBY UKŁADU NERWOWEGO<18 R.Ż.,1a,2014,2014
,,105,118,1.12,0.0,0.03,1,1,7176.0,138.0,7176.0,138.0,B01 LECZENIE WYSIĘKOWEJ POSTACI AMD WERTEPORFINĄ PRZY ZASTOSOWANIU TERAPII FOTODYNAMICZNEJ,1a,2014,2014
,,8092,20486,2.53,0.28,5.99,0,0,2573.41,50.0,2573.41,50.0,B02 LECZENIE WYSIĘKOWEJ POSTACI AMD Z ZASTOSOWANIEM INIEKCJI DOSZKLISTKOWYCH PRZECIWCIAŁA MONOKLONALNEGO ANTY-VEGF/ REKOMBINOWANEGO BIAŁKA FUZYJNEGO,1a,2014,2014
,,148,148,1.0,0.0,0.04,5,4,8944.0,172.0,8944.0,172.0,B04 PRZESZCZEP ROGÓWKI - KATEGORIA I *,1a,2014,2014
,,743,792,1.07,0.01,0.23,5,4,7085.39,136.26,7085.39,136.26,B05 PRZESZCZEP ROGÓWKI - KATEGORIA II *,1a,2014,2014
,,34,34,1.0,0.0,0.01,4,4,5720.0,110.0,5720.0,110.0,B06 PRZESZCZEP ROGÓWKI - KATEGORIA III *,1a,2014,2014
,,2120,2307,1.09,0.03,0.67,2,2,5399.97,104.81,5399.97,104.81,B11 KOMPLEKSOWE ZABIEGI W ZAĆMIE I JASKRZE *,1a,2014,2014
,,6809,8046,1.18,0.11,2.35,2,2,8287.62,161.49,8241.63,160.6,"B16 ZABIEGI Z WYKONANIEM WITREKTOMII Z UŻYCIEM OLEJU SILIKONOWEGO LUB DEKALINY, W TYM WIELOPROCEDURALNE *",1a,2014,2014
,,8204,8760,1.07,0.12,2.56,2,2,6948.94,135.42,6947.53,135.39,"B17 ZABIEGI Z WYKONANIEM WITREKTOMII, W TYM WIELOPROCEDURALNE *",1a,2014,2014
,,80013,86625,1.08,1.2,25.31,1,2,2660.92,51.85,2658.98,51.81,B18 USUNIĘCIE ZAĆMY POWIKŁANEJ Z JEDNOCZESNYM WSZCZEPIENIEM SOCZEWKI,1a,2014,2014
,,123966,134224,1.08,1.86,39.22,1,0,2296.1,45.01,2295.84,45.0,B19 USUNIĘCIE ZAĆMY NIEPOWIKŁANEJ Z JEDNOCZESNYM WSZCZEPIENIEM SOCZEWKI,1a,2014,2014
,,1938,2158,1.11,0.03,0.63,2,2,1721.02,33.83,1721.02,33.83,B23 ŚREDNIE ZABIEGI NA SOCZEWCE *,1a,2014,2014
,,3057,3254,1.06,0.05,0.95,0,0,414.83,8.19,414.59,8.18,B24 MAŁE ZABIEGI NA SOCZEWCE,1a,2014,2014
,,1688,1891,1.12,0.03,0.55,1,0,1990.83,38.61,1988.83,38.57,B32 DUŻE ZABIEGI NA APARACIE OCHRONNYM OKA *,1a,2014,2014
,,6278,7050,1.12,0.1,2.06,0,0,725.44,14.21,719.46,14.1,B33 ŚREDNIE ZABIEGI NA APARACIE OCHRONNYM OKA *,1a,2014,2014
,,2971,3086,1.04,0.04,0.9,0,0,231.94,4.5,205.71,4.0,B34 MAŁE ZABIEGI NA APARACIE OCHRONNYM OKA,1a,2014,2014
,,686,698,1.02,0.01,0.2,2,2,8261.12,163.93,8250.5,163.6,B42 DUŻE ZABIEGI NA OCZODOLE I APARACIE ŁZOWYM *,1a,2014,2014
,,1873,2052,1.1,0.03,0.6,0,0,2116.69,42.11,2086.47,41.53,B43 ŚREDNIE ZABIEGI NA OCZODOLE I APARACIE ŁZOWYM *,1a,2014,2014
,,3111,3337,1.07,0.05,0.98,0,0,636.47,12.3,569.52,11.0,B44 MAŁE ZABIEGI NA OCZODOLE I APARACIE ŁZOWYM,1a,2014,2014
,,1847,1976,1.07,0.03,0.58,2,2,1554.28,30.44,1545.06,29.77,B52 DUŻE ZABIEGI NA ROGÓWCE I TWARDÓWCE *,1a,2014,2014
,,2361,2480,1.05,0.03,0.72,0,0,631.32,12.25,631.32,12.25,B53 ŚREDNIE ZABIEGI NA ROGÓWCE I TWARDÓWCE *,1a,2014,2014
,,5649,5836,1.03,0.08,1.71,1,2,2214.08,43.31,2214.04,43.31,B63 ZABIEGI W ZAKRESIE MIĘŚNI OKORUCHOWYCH *,1a,2014,2014
,,2752,3051,1.11,0.04,0.89,3,2,4067.27,79.05,4065.59,79.01,B72 DUŻE ZABIEGI W JASKRZE I NA NACZYNIÓWCE *,1a,2014,2014
,,892,928,1.04,0.01,0.27,2,2,2628.06,51.16,2627.69,51.15,B73 ŚREDNIE ZABIEGI W JASKRZE I NA NACZYNIÓWCE *,1a,2014,2014
,,1880,2169,1.15,0.03,0.63,1,0,236.14,4.57,228.69,4.43,B74 MAŁE ZABIEGI W JASKRZE I NA NACZYNIÓWCE *,1a,2014,2014
,,979,1003,1.02,0.01,0.29,3,2,5026.14,97.6,4991.92,96.95,B81 DUŻE ZABIEGI NA SIATKÓWCE *,1a,2014,2014
,,89,89,1.0,0.0,0.03,2,2,2496.0,48.0,2496.0,48.0,B82 DUŻE ZABIEGI NA CIELE SZKLISTYM,1a,2014,2014
,,61,61,1.0,0.0,0.02,2,2,1458.38,28.2,1458.38,28.2,B83 ŚREDNIE ZABIEGI WITREORETINALNE *,1a,2014,2014
,,3365,5422,1.61,0.08,1.58,0,0,685.82,13.31,683.36,13.26,B84 MAŁE ZABIEGI WITREORETINALNE *,1a,2014,2014
,,3349,3500,1.05,0.05,1.02,0,0,151.92,2.96,133.65,2.6,B94 INNE PROCEDURY W ZAKRESIE OKA *,1a,2014,2014
,,27061,31541,1.17,0.44,9.22,3,2,1800.05,34.6,1778.22,34.31,B98 LECZENIE ZACHOWAWCZE OKULISTYCZNE,1a,2014,2014
,,1181,1187,1.01,0.02,0.43,17,14,26834.77,519.86,25376.85,491.72,"C01 ROZLEGŁE OPERACJE NOWOTWORÓW JAMY USTNEJ, GARDŁA I KRTANI Z REKONSTRUKCJĄ *",1a,2014,2014
,,576,580,1.01,0.01,0.21,4,4,107054.95,2059.84,107011.2,2059.0,C05 LECZENIE ZABURZEŃ SŁUCHU ZA POMOCĄ IMPLANTÓW ŚLIMAKOWYCH I PNIOWYCH *,1a,2014,2014
,,273,275,1.01,0.0,0.1,3,2,34888.1,672.07,34884.52,672.0,C06 LECZENIE ZABURZEŃ SŁUCHU ZA POMOCĄ INNYCH WSZCZEPIALNYCH ELEKTRONICZNYCH PROTEZ SŁUCHU *,1a,2014,2014
,,202,202,1.0,0.0,0.07,0,0,35680.63,688.0,35680.63,688.0,C07 WYMIANA PROCESORA MOWY,1a,2014,2014
,,4981,5155,1.03,0.07,1.85,5,4,11650.9,225.15,11470.16,221.67,"C11 KOMPLEKSOWE ZABIEGI JAMY USTNEJ, GARDŁA I KRTANI *",1a,2014,2014
,,6273,6781,1.08,0.09,2.43,4,0,3147.51,61.68,2422.55,46.86,"C12 DUŻE ZABIEGI JAMY USTNEJ, GARDŁA I KRTANI *",1a,2014,2014
,,54304,54591,1.01,0.76,19.6,2,2,2174.05,42.16,2172.17,42.13,"C13 ŚREDNIE ZABIEGI JAMY USTNEJ, GARDŁA I KRTANI < 18 R.Ż.",1a,2014,2014
,,30525,32045,1.05,0.44,11.51,2,2,977.17,19.23,955.55,18.46,"C14 ŚREDNIE ZABIEGI JAMY USTNEJ, GARDŁA I KRTANI > 17 R.Ż.",1a,2014,2014
,,3194,3278,1.03,0.05,1.18,0,0,289.99,5.59,259.29,5.0,"C15 MAŁE ZABIEGI JAMY USTNEJ, GARDŁA I KRTANI *",1a,2014,2014
,,1146,1161,1.01,0.02,0.42,8,3,19445.95,376.01,17878.04,345.02,C21 KOMPLEKSOWE ZABIEGI SZCZĘKOWO-TWARZOWE *,1a,2014,2014
,,9797,10196,1.04,0.14,3.66,4,2,8400.41,161.93,8218.18,158.34,C22 DUŻE ZABIEGI SZCZĘKOWO-TWARZOWE *,1a,2014,2014
,,836,843,1.01,0.01,0.3,2,2,3110.55,59.87,3066.31,59.02,C23 ŚREDNIE ZABIEGI SZCZĘKOWO-TWARZOWE *,1a,2014,2014
,,3562,4065,1.14,0.06,1.46,0,0,603.53,11.65,591.66,11.42,C24 MAŁE ZABIEGI SZCZĘKOWO-TWARZOWE *,1a,2014,2014
,,17,17,1.0,0.0,0.01,4,4,15605.87,300.11,14560.0,280.0,"C25 ROZLEGŁE ZABIEGI KOREKCYJNE WAD WRODZONYCH TWARZOCZASZKI, JAMY USTNEJ I GARDŁA < 18 R.Ż *",1a,2014,2014
,,305,318,1.04,0.0,0.11,4,2,11731.11,225.6,11648.0,224.0,"C26 KOMPLEKSOWE ZABIEGI KOREKCYJNE WAD WRODZONYCH TWARZOCZASZKI, JAMY USTNEJ I GARDŁA < 18 R.Ż *",1a,2014,2014
,,493,499,1.01,0.01,0.18,4,3,7605.16,146.26,7487.13,143.99,"C27 DUŻE ZABIEGI KOREKCYJNE WAD WRODZONYCH TWARZOCZASZKI, JAMY USTNEJ I GARDŁA < 18 R.Ż *",1a,2014,2014
,,290,302,1.04,0.0,0.11,3,2,4723.04,91.1,3238.27,62.55,"C28 ŚREDNIE ZABIEGI KOREKCYJNE WAD WRODZONYCH TWARZOCZASZKI, JAMY USTNEJ I GARDŁA < 18 R.Ż *",1a,2014,2014
,,1834,1836,1.0,0.03,0.66,0,0,1505.61,29.4,1500.29,29.29,"C29 MAŁE ZABIEGI KOREKCYJNE WAD WRODZONYCH TWARZOCZASZKI, JAMY USTNEJ I GARDŁA < 18 R.Ż *",1a,2014,2014
,,7863,8402,1.07,0.12,3.02,2,2,8434.01,162.47,8409.55,162.0,C31 KOMPLEKSOWE ZABIEGI USZU *,1a,2014,2014
,,4021,4191,1.04,0.06,1.5,2,2,3512.32,67.63,3491.51,67.23,C32 DUŻE ZABIEGI USZU *,1a,2014,2014
,,1633,1661,1.02,0.02,0.6,1,0,969.38,18.74,969.24,18.74,C33 ŚREDNIE ZABIEGI USZU *,1a,2014,2014
,,3542,3713,1.05,0.05,1.33,0,0,623.56,12.06,568.6,11.0,C34 MAŁE ZABIEGI USZU *,1a,2014,2014
,,14549,14706,1.01,0.2,5.28,3,3,4927.93,95.04,4852.19,93.58,C41 KOMPLEKSOWE ZABIEGI NOSA *,1a,2014,2014
,,30369,30585,1.01,0.42,10.98,3,3,2735.75,52.99,2732.62,52.92,C42 DUŻE ZABIEGI NOSA *,1a,2014,2014
,,7205,7355,1.02,0.1,2.64,1,0,1515.4,29.48,1509.32,29.36,C43 ŚREDNIE ZABIEGI NOSA *,1a,2014,2014
,,7290,7432,1.02,0.1,2.67,0,0,425.18,8.21,414.25,8.0,C44 MAŁE ZABIEGI NOSA *,1a,2014,2014
,,102,104,1.02,0.0,0.04,4,2,3040.45,144.16,2928.71,56.42,C45 DUŻE ZABIEGI ENDOSKOPOWE < 18 R.Ż.,1a,2014,2014
,,692,724,1.05,0.01,0.26,0,0,1662.98,32.04,1652.33,31.83,C46 ŚREDNIE ZABIEGI ENDOSKOPOWE < 18 R.Ż.,1a,2014,2014
,,75,75,1.0,0.0,0.03,7,6,3282.77,63.13,3275.83,63.0,C48 OSTRE ZAPALENIE ZATOK PRZYNOSOWYCH < 18 R.Ż Z PW,1a,2014,2014
,,13447,15274,1.14,0.21,5.48,4,2,2096.69,40.93,2049.05,39.5,"C56A POWAŻNE CHOROBY GARDŁA, USZU I NOSA >17 R.Ż.",1a,2014,2014
,,1575,1868,1.19,0.03,0.67,2,0,1703.14,32.95,1673.47,32.38,"C56B POWAŻNE CHOROBY GARDŁA, USZU I NOSA < 18 R.Ż.",1a,2014,2014
,,54387,57024,1.05,0.79,20.48,3,2,947.32,18.34,929.32,17.93,"C57 INNE CHOROBY GARDŁA, USZU I NOSA",1a,2014,2014
,,2028,2060,1.02,0.03,0.74,1,0,174.8,3.37,160.35,3.09,"C64 INNE PROCEDURY JAMY USTNEJ, GARDŁA, KRTANI, NOSA I USZU *",1a,2014,2014
,,3427,3443,1.0,0.05,0.8,11,7,24014.58,491.59,22024.77,426.61,D01 ZŁOŻONE ZABIEGI KLATKI PIERSIOWEJ *,1a,2014,2014
,,5869,6115,1.04,0.08,1.42,9,7,16701.62,346.44,15077.49,293.95,D02 KOMPLEKSOWE ZABIEGI KLATKI PIERSIOWEJ *,1a,2014,2014
,,15539,17115,1.1,0.24,3.97,4,2,7423.12,150.97,6944.77,137.87,D03 DUŻE ZABIEGI KLATKI PIERSIOWEJ *,1a,2014,2014
,,3586,3760,1.05,0.05,0.87,2,2,1678.92,32.76,1650.18,32.02,D04 ŚREDNIE I MAŁE ZABIEGI KLATKI PIERSIOWEJ,1a,2014,2014
,,5481,5693,1.04,0.08,1.32,0,0,655.02,12.7,649.11,12.58,D05 BRONCHOSKOPIA *,1a,2014,2014
,,30331,35409,1.17,0.49,8.2,6,2,2438.55,49.29,2397.1,46.43,D10 DYCHAWICA OSKRZELOWA,1a,2014,2014
,,12804,13591,1.06,0.19,3.15,9,7,4608.44,95.44,4147.87,80.08,D16 ZATOR PŁUCNY,1a,2014,2014
,,2837,3507,1.24,0.05,0.81,13,14,5548.99,113.48,4616.56,89.3,"D17 ROPIEŃ PŁUC, ROPOWICA",1a,2014,2014
,,39353,41103,1.04,0.57,9.52,8,7,4381.8,86.69,3735.91,72.08,"D18 ZAPALENIE PŁUC NIETYPOWE, WIRUSOWE",1a,2014,2014
,,4964,5643,1.14,0.08,1.31,8,7,3701.41,71.85,3636.06,70.56,D19 ROZSTRZENIE OSKRZELI,1a,2014,2014
,,1282,1421,1.11,0.02,0.33,6,3,2191.01,42.69,1634.73,31.99,D20 GRUŹLICA,1a,2014,2014
,,1390,2512,1.81,0.03,0.58,4,0,7721.08,195.39,7432.19,144.58,D21 ZWŁÓKNIENIE TORBIELOWATE,1a,2014,2014
,,7896,9291,1.18,0.13,2.15,8,7,2810.45,54.85,2675.79,51.69,D26 WYSIĘKOWE ZAPALENIE OPŁUCNEJ,1a,2014,2014
,,47768,63925,1.34,0.89,14.81,6,7,3908.89,84.76,3816.71,73.76,D28 CHOROBY NOWOTWOROWE UKŁADU ODDECHOWEGO I KLATKI PIERSIOWEJ,1a,2014,2014
,,12554,13701,1.09,0.19,3.17,1,1,1189.61,22.97,1187.96,22.96,D36 ZABURZENIA ODDYCHANIA W CZASIE SNU,1a,2014,2014
,,25810,27101,1.05,0.38,6.28,4,2,1857.91,36.37,1779.41,34.43,D37 INNE CHOROBY UKŁADU ODDECHOWEGO,1a,2014,2014
,,5043,5323,1.06,0.07,1.23,6,6,3338.26,67.41,2402.06,46.35,D38 OBRZĘK PŁUC,1a,2014,2014
,,215,250,1.16,0.0,0.06,12,8,4662.23,90.25,3932.46,76.21,D45 LECZENIE NIEWYDOLNOŚCI ODDYCHANIA PRZY ZASTOSOWANIU NIEINWAZYJNEJ WENTYLACJI MECHANICZNEJ (NWM) >17R.Ż.,1a,2014,2014
,,73067,81854,1.12,1.14,18.96,6,7,2025.0,40.07,1853.5,35.77,D46 POCHP I INNE OBTURACYJNE CHOROBY UKŁADU ODDECHOWEGO,1a,2014,2014
,,11908,12190,1.02,0.17,2.82,8,7,2518.26,51.24,1968.56,38.02,D47 ZAPALENIE PŁUC Z PW,1a,2014,2014
,,26182,26813,1.02,0.37,6.21,8,7,1701.3,34.79,1328.37,25.62,D48 ZAPALENIE PŁUC BEZ PW,1a,2014,2014
,,1800,1845,1.02,0.03,0.43,8,7,6187.45,120.0,4731.84,91.27,D49 USZKODZENIA INHALACYJNE PŁUC,1a,2014,2014
,,8410,10600,1.26,0.15,2.46,7,2,4647.22,90.59,4379.48,84.83,D50 ZWŁÓKNIENIE I PYLICA PŁUC,1a,2014,2014
,,4532,4976,1.1,0.07,1.15,6,5,2733.97,55.14,2373.84,45.81,D51 ODMA OPŁUCNOWA,1a,2014,2014
,,22477,26082,1.16,0.36,6.04,8,7,5682.46,110.55,2480.39,47.91,D52 NIEWYDOLNOŚĆ ODDECHOWA,1a,2014,2014
,,613,701,1.14,0.01,0.16,7,5,7061.04,2382.42,4500.62,87.03,D53 NADCIŚNIENIE PŁUCNE > 17 R.Ż.,1a,2014,2014
,,321,327,1.02,0.0,0.08,8,8,1941.34,37.5,1933.81,37.36,D54 ZAPALENIE OPŁUCNEJ,1a,2014,2014
,,5099,7292,1.43,0.1,1.69,4,2,4854.24,97.03,4722.27,91.87,"D55 ZIARNINIAKI, CHOROBY PŁUC ALERGICZNE I Z AUTOIMMUNIZACJI",1a,2014,2014
,,28,35,1.25,0.0,0.01,4,2,3314.63,63.74,3307.2,63.6,D56 CIĘŻKIE WADY ROZWOJOWE < 18 R.Ż,1a,2014,2014
,,845,864,1.02,0.01,0.1,8,6,27990.05,566.37,21196.63,408.24,E02 INNE ZABIEGI KARDIOCHIRURGICZNE > 17 R.Ż. *,1a,2014,2014
,,167,170,1.02,0.0,0.02,2,2,19410.99,373.29,16862.07,324.27,E03 INNE ZABIEGI KARDIOCHIRURGICZNE < 18 R.Ż.,1a,2014,2014
,,276,276,1.0,0.0,0.03,15,15,41878.72,807.15,34315.57,661.57,E04 POMOSTOWANIE NACZYŃ WIEŃCOWYCH Z PLASTYKĄ *,1a,2014,2014
,,8396,8490,1.01,0.12,0.97,9,8,24802.14,477.66,21119.42,406.51,E05 POMOSTOWANIE NACZYŃ WIEŃCOWYCH > 69 R.Ż. LUB Z PW *,1a,2014,2014
,,4506,4521,1.0,0.06,0.52,9,8,22187.61,427.67,20002.56,384.72,E06 POMOSTOWANIE NACZYŃ WIEŃCOWYCH < 70 R.Ż. BEZ PW *,1a,2014,2014
,,263,264,1.0,0.0,0.03,23,20,34826.56,670.19,23721.11,456.61,E07 POMOSTOWANIE NACZYŃ WIEŃCOWYCH >75 R.Ż. I > 16 DNI *,1a,2014,2014
,,28965,29273,1.01,0.41,3.34,4,2,4891.79,95.16,4608.78,89.0,E10 OZW - DIAGNOSTYKA INWAZYJNA *,1a,2014,2014
,,2463,2466,1.0,0.03,0.28,6,4,17864.12,348.37,16594.98,319.81,E11 OZW - LECZENIE INWAZYJNE DWUETAPOWE > 3 DNI *,1a,2014,2014
,,55776,58686,1.05,0.82,6.69,4,4,14806.6,290.92,13752.96,265.45,E12 OZW - LECZENIE INWAZYJNE ZŁOŻONE *,1a,2014,2014
,,11062,11221,1.01,0.16,1.28,6,4,13548.87,263.63,12435.97,239.56,E13 OZW - LECZENIE INWAZYJNE > 3 DNI *,1a,2014,2014
,,3275,3314,1.01,0.05,0.38,2,3,9812.66,189.36,9330.99,180.0,E14 OZW - LECZENIE INWAZYJNE < 4 DNI *,1a,2014,2014
,,11127,11424,1.03,0.16,1.3,5,3,2827.18,58.37,2640.83,50.93,E16 OZW > 69 R.Ż. LUB Z PW,1a,2014,2014
,,5572,5674,1.02,0.08,0.65,4,2,1798.01,34.79,1665.2,32.14,E17 OZW < 70 R.Ż.,1a,2014,2014
,,9081,9356,1.03,0.13,1.07,4,1,1705.25,33.2,1454.13,28.08,E18 OZW BEZ UNIESIENIA ST,1a,2014,2014
,,23,23,1.0,0.0,0.0,2,0,6925.2,133.18,6708.0,129.0,E19 OZW - LECZENIE Z ZASTOSOWANIEM LEKU TROMBOLITYCZNEGO DRUGIEJ/ TRZECIEJ GENERACJI,1a,2014,2014
,,9501,9977,1.05,0.14,1.14,3,1,15563.11,304.59,15185.57,294.93,E20 ANGIOPLASTYKA WIEŃCOWA Z IMPLANTACJĄ NIE MNIEJ NIŻ 2 STENTÓW DES,1a,2014,2014
,,1041,1053,1.01,0.01,0.12,3,3,28402.29,552.44,28377.05,551.95,E21 PRZEZSKÓRNE ZAMKNIĘCIE NIEPRAWIDŁOWYCH POŁĄCZEŃ WEWNĄTRZSERCOWYCH I ZEWNĄTRZSERCOWYCH > 17 R.Ż. *,1a,2014,2014
,,307,317,1.03,0.0,0.04,6,3,25603.39,512.31,24400.09,488.88,E22 PRZEZSKÓRNE WALWULOPLASTYKI > 17 R.Ż.*,1a,2014,2014
,,24082,26739,1.11,0.37,3.05,2,1,12842.18,250.81,12611.86,244.92,E23 ANGIOPLASTYKA WIEŃCOWA Z IMPLANTACJĄ JEDNEGO STENTU DES,1a,2014,2014
,,671,682,1.02,0.01,0.08,3,1,8183.32,159.06,7714.33,149.94,E24 ANGIOPLASTYKA Z IMPLANTACJĄ NIE MNIEJ NIŻ DWÓCH STENTÓW LUB WIELONACZYNIOWA *,1a,2014,2014
,,2213,2269,1.03,0.03,0.26,2,1,6672.7,129.68,6381.11,123.98,E25 ANGIOPLASTYKA Z ZASTOSOWANIEM JEDNEGO STENTU I INNE ZABIEGI *,1a,2014,2014
,,2815,2940,1.04,0.04,0.34,2,1,5276.08,102.77,4927.15,95.98,E26 ANGIOPLASTYKA WIEŃCOWA BALONOWA *,1a,2014,2014
,,54972,55627,1.01,0.77,6.34,1,1,1783.88,35.96,1645.82,31.98,E27 KORONAROGRAFIA I INNE ZABIEGI INWAZYJNE *,1a,2014,2014
,,8194,8229,1.0,0.11,0.94,4,2,6492.23,128.67,6199.84,119.93,E31 WSZCZEPIENIE/ WYMIANA ROZRUSZNIKA JEDNOJAMOWEGO *,1a,2014,2014
,,20501,20585,1.0,0.29,2.35,4,2,7847.33,155.54,7690.42,148.92,E32 WSZCZEPIENIE/ WYMIANA ROZRUSZNIKA DWUJAMOWEGO *,1a,2014,2014
,,536,537,1.0,0.01,0.06,5,2,17008.23,337.54,16794.81,324.97,E33 WSZCZEPIENIE/ WYMIANA UKŁADU Z FUNKCJĄ RESYNCHRONIZUJĄCĄ SERCA (CRT) *,1a,2014,2014
,,7734,7783,1.01,0.11,0.89,4,3,26855.84,523.63,26421.49,511.74,E34 WSZCZEPIENIE/ WYMIANA KARDIOWERTERA-DEFIBRYLATORA JEDNO-/ DWUJAMOWEGO *,1a,2014,2014
,,3236,3260,1.01,0.05,0.37,4,3,39949.94,777.51,39589.49,768.97,E36 WSZCZEPIENIE/ WYMIANA CRT-D > 17 R.Ż. *,1a,2014,2014
,,1249,1311,1.05,0.02,0.15,4,3,3153.82,61.21,3038.67,59.0,E37 REPERACJA/ REPOZYCJA/ REWIZJA/ WYMIANA ELEKTRODY/ UKŁADU STYMULUJĄCEGO/ KARDIOWERTERA-DEFIBRYLATORA *,1a,2014,2014
,,434,462,1.06,0.01,0.05,4,3,28593.37,551.75,28227.54,544.71,E39 LECZENIE ZABIEGOWE ZABURZEŃ RYTMU < 18 R.Ż.,1a,2014,2014
,,4833,5048,1.04,0.07,0.58,2,2,25744.59,497.19,25704.65,496.42,E41 ABLACJA ZABURZEŃ RYTMU Z WYKORZYSTANIEM SYSTEMU ELEKTROANATOMICZNEGO 3D *,1a,2014,2014
,,4577,4720,1.03,0.07,0.54,2,2,15372.63,304.07,15355.17,299.35,E43 ABLACJA ZABURZEŃ RYTMU *,1a,2014,2014
,,1117,1130,1.01,0.02,0.13,2,2,6631.26,129.67,6628.73,129.62,E44 DIAGNOSTYKA INWAZYJNA ZABURZEŃ RYTMU SERCA *,1a,2014,2014
,,845,854,1.01,0.01,0.1,3,3,23532.49,461.01,23532.23,461.0,E45 KRIOABLACJA BALONOWA W MIGOTANIU PRZEDSIONKÓW,1a,2014,2014
,,56,56,1.0,0.0,0.01,15,8,13950.89,268.42,6754.61,130.0,E50 OSTRA LUB ZDEKOMPENSOWANA NIEWYDOLNOŚC KRĄŻENIA - LECZENIE W OINK,1a,2014,2014-05-01T00:00:00-2014-12-31T00:00:00
,,1057,1259,1.19,0.02,0.14,17,7,11163.78,224.24,8854.31,170.84,E51 ZAPALENIE WSIERDZIA,1a,2014,2014
,,11863,13227,1.12,0.18,1.51,8,7,5356.44,109.49,4187.44,80.93,E52 ZAAWANSOWANA NIEWYDOLNOŚĆ KRĄŻENIA,1a,2014,2014
,,122147,142238,1.16,1.98,16.21,7,6,2775.59,54.54,2457.72,47.42,E53 NIEWYDOLNOŚĆ KRĄŻENIA > 69 R.Ż. LUB Z PW,1a,2014,2014
,,17769,19945,1.12,0.28,2.27,6,7,2092.45,42.53,1633.4,31.55,E54 NIEWYDOLNOŚĆ KRĄŻENIA < 70 R.Ż. BEZ PW,1a,2014,2014
,,5964,6138,1.03,0.09,0.7,6,7,2114.19,41.19,2072.47,39.97,E55 ZAKRZEPICA ŻYŁ GŁĘBOKICH,1a,2014,2014
,,42821,45432,1.06,0.63,5.18,5,2,2026.75,40.82,1969.94,38.08,E56 CHOROBA NIEDOKRWIENNA SERCA > 69 R.Ż. LUB Z PW,1a,2014,2014
,,30527,31857,1.04,0.44,3.63,4,2,1515.59,29.65,1474.88,28.51,E57 CHOROBA NIEDOKRWIENNA SERCA > 17 R.Ż. < 70 R.Ż. BEZ PW,1a,2014,2014
,,4111,4128,1.0,0.06,0.47,2,1,7326.94,148.61,2386.63,46.0,E59 NAGŁE ZATRZYMANIE KRĄŻENIA,1a,2014,2014
,,46224,54926,1.19,0.76,6.26,3,2,1666.79,33.47,1621.14,31.31,E61 ZABURZENIA RYTMU SERCA > 69 R.Ż. LUB Z PW,1a,2014,2014
,,36019,43161,1.2,0.6,4.92,2,2,810.61,16.32,796.64,15.4,E62 ZABURZENIA RYTMU SERCA > 17 R.Ż. < 70 R.Ż. BEZ PW,1a,2014,2014
,,499,632,1.27,0.01,0.07,3,0,9425.4,181.69,9105.46,175.54,E63 ZABURZENIA RYTMU SERCA < 1 R.Ż. LUB < 18 R.Ż. Z PW,1a,2014,2014
,,2148,2414,1.12,0.03,0.28,3,2,2168.03,41.73,2165.14,41.67,E64 ZABURZENIA RYTMU SERCA > 0 R.Ż. I < 18 R.Ż.,1a,2014,2014
,,21677,22248,1.03,0.31,2.54,3,2,1302.59,25.2,1269.32,24.5,E71 OMDLENIE I ZAPAŚĆ,1a,2014,2014
,,7399,7485,1.01,0.1,0.85,2,2,482.33,9.67,480.83,9.27,E72 NIEINWAZYJNA DIAGNOSTYKA BÓLU W KLATCE PIERSIOWEJ > 17 R.Ż.,1a,2014,2014
,,42716,47127,1.1,0.65,5.37,6,2,2968.77,58.05,2859.52,55.23,E73 CHOROBY ZASTAWEK SERCA > 17 R.Ż.,1a,2014,2014
,,3014,3367,1.12,0.05,0.38,2,2,3134.17,60.6,3056.21,59.1,E74 WRODZONE WADY SERCA > 17 R.Ż.,1a,2014,2014
,,3124,4309,1.38,0.06,0.49,3,2,15013.09,301.6,9972.23,193.3,E75 WRODZONE WADY SERCA < 1 R.Ż. LUB < 18 R.Ż. Z PW,1a,2014,2014
,,4701,5598,1.19,0.08,0.64,2,2,3183.84,61.94,2394.94,46.24,E76 WRODZONE WADY SERCA > 0 R.Ż. I < 18 R.Ż.,1a,2014,2014
,,48178,54041,1.12,0.75,6.16,6,7,2931.07,58.0,2708.48,52.28,E77 INNE CHOROBY UKŁADU KRĄŻENIA > 17 R.Ż.,1a,2014,2014
,,367,465,1.27,0.01,0.05,4,2,14515.34,303.69,12342.12,237.75,E78 INNE CHOROBY UKŁADU KRĄŻENIA < 1 R.Ż. ALBO < 18 R.Ż. Z PW,1a,2014,2014
,,4857,5284,1.09,0.07,0.6,3,2,2945.89,74.75,2857.14,54.95,E79 INNE CHOROBY UKŁADU KRĄŻENIA > 0 R.Ż. I < 18 R.Ż.,1a,2014,2014
,,1498,1523,1.02,0.02,0.17,9,8,4245.89,81.72,4223.74,81.3,E86 NADCIŚNIENIE TĘTNICZE OPORNE I WTÓRNE,1a,2014,2014
,,2349,2411,1.03,0.03,0.27,5,4,3117.14,60.01,3116.69,60.01,E87 CIĘŻKIE NADCIŚNIENIE TĘTNICZE > 17 R.Ż.,1a,2014,2014
,,56920,58700,1.03,0.82,6.69,4,3,1417.11,27.82,1390.21,26.86,E88 NADCIŚNIENIE TĘTNICZE > 17 R.Ż.,1a,2014,2014
,,605,606,1.0,0.01,0.09,16,14,38089.48,743.24,19257.81,376.64,F01 KOMPLEKSOWE ZABIEGI PRZEŁYKU *,1a,2014,2014
,,2036,2365,1.16,0.03,0.35,3,2,11937.7,234.3,11048.18,215.44,"F02 DUŻE ZABIEGI PRZEŁYKU, W TYM PROTEZOWANIE *",1a,2014,2014
,,3236,4921,1.52,0.07,0.72,2,2,2635.39,51.05,2570.02,49.69,F03 ŚREDNIE I ENDOSKOPOWE ZABIEGI PRZEŁYKU *,1a,2014,2014
,,7406,7596,1.03,0.11,1.11,0,0,531.68,10.44,508.98,10.01,F04 DIAGNOSTYCZNE I MAŁE  ZABIEGI PRZEWODU POKARMOWEGO *,1a,2014,2014
,,25912,27526,1.06,0.38,4.02,3,2,2051.86,40.03,1969.44,38.06,F07 CHOROBY PRZEŁYKU,1a,2014,2014
,,4746,4760,1.0,0.07,0.7,9,3,16409.54,320.19,12406.44,239.36,F11 KOMPLEKSOWE ZABIEGI ŻOŁĄDKA I DWUNASTNICY *,1a,2014,2014
,,7029,7216,1.03,0.1,1.05,7,6,7369.04,143.97,5570.93,107.46,F12 DUŻE ZABIEGI ŻOŁĄDKA I DWUNASTNICY *,1a,2014,2014
,,6965,7530,1.08,0.1,1.1,1,0,2540.88,52.66,1856.06,35.87,F13 ZABIEGI LECZNICZE ŻOŁĄDKA I DWUNASTNICY *,1a,2014,2014
,,70446,73954,1.05,1.03,10.81,3,2,1759.6,34.66,1672.41,32.29,F16 CHOROBY ŻOŁĄDKA I DWUNASTNICY,1a,2014,2014
,,4955,5007,1.01,0.07,0.73,12,8,15925.74,309.32,10539.28,203.42,F21 KOMPLEKSOWE ZABIEGI JELITA CIENKIEGO *,1a,2014,2014
,,8064,8196,1.02,0.11,1.2,6,0,9648.98,188.18,6946.35,134.05,F22 DUŻE I ENDOSKOPOWE ZABIEGI JELITA CIENKIEGO *,1a,2014,2014
,,7786,8551,1.1,0.12,1.25,2,2,3017.11,58.16,2538.57,48.93,F26 CHOROBY JELITA CIENKIEGO (BEZ CHORÓB ZAPALNYCH),1a,2014,2014
,,14215,14270,1.0,0.2,2.09,11,8,14943.94,288.53,12206.61,235.64,F31A KOMPLEKSOWE ZABIEGI JELITA GRUBEGO > 17 R. Ż.,1a,2014,2014
,,61,61,1.0,0.0,0.01,13,11,17641.77,339.54,14787.72,284.64,F31B KOMPLEKSOWE ZABIEGI JELITA GRUBEGO < 18 R. Ż.,1a,2014,2014
,,8748,9021,1.03,0.13,1.32,9,8,7908.82,156.18,5884.92,113.61,F32 DUŻE I ENDOSKOPOWE ZABIEGI JELITA GRUBEGO *,1a,2014,2014
,,106019,110323,1.04,1.53,16.12,1,0,1076.67,20.9,1065.68,20.67,F34 ŚREDNIE I ENDOSKOPOWE ZABIEGI PRZEWODU POKARMOWEGO *,1a,2014,2014
,,39345,43060,1.09,0.6,6.29,4,2,2455.29,50.6,2334.16,45.06,F36 CHOROBY JELITA GRUBEGO,1a,2014,2014
,,17354,17583,1.01,0.24,2.57,7,5,8486.17,168.91,6440.78,124.22,F42 DUŻE ZABIEGI JAMY BRZUSZNEJ *,1a,2014,2014
,,9121,9736,1.07,0.14,1.42,5,2,3687.16,74.29,2401.6,46.35,F43 ŚREDNIE I ENDOSKOPOWE LECZNICZE ZABIEGI JAMY BRZUSZNEJ *,1a,2014,2014
